순위,ISBN,상품번호,상품명,판매가,YES포인트,저자,출판사,설명,출고예상일,관리분류
164,9788936464066,7828338,내가 안개마을에 있을 때,"9,000원",500원,딩링 저/김미란 역,창비,"전통에 저항하고 혁명에 앞장서는 
중국 현대 대표 여성작가 딩링 단편선

‘죽은 듯 고요한 문단을 공격한 폭탄’이라 불리며 중국 현대를 대표하는 여성작가로 꼽히는 딩링. 전통에 저항하고 혁명에 앞장서는 여성 지식인을 형상화한 작품들을 다수 남겼으며, 50년이 넘는 긴 집필 활동 동안 요동치듯 격변했던 중국현대사는 작가의 삶과 작품세계에 뚜렷한 각인을 남겨 오늘날에도 다양한 관점에서 조명되는 작가이다. 이 책은 네편의 중단편(『발사되지 않은 총알 하나』 『내가 안개마을에 있을 때』 『병원에서』 ??두완샹??)을 싣고 있는데, 혁명의 요람이라 불리던 서부전선에서 농민, 홍군 들과 생활하다가 공산혁명 이후 문화계 관료로 활동하던 시기의 작품들이다. 초기 작품들이 여성의 정체성과 자의식을 주제로 현대적인 여성상, 혁명과 여성문제 등을 제기하고 있다면, 이 책에 수록된 작품들은 공산당의 비판과 혁명기 지식인으로서 부딪힌 질곡 등을 겪은 이후의 작품세계를 대변한다.",1,국내도서-소설/시/희곡
165,9791194293668,141238131,나는 범죄조직의 시나리오 작가다,"15,120원",840원,린팅이 저/허유영 역,반타,"★★★★★ 대만 영화, 드라마 제작 확정
★★★★★ 2022 부산국제영화제 스토리 마켓 IP 선정작

완벽해 보이는 타인의 인생을 부러워한 적이 있는가? SNS 화면 속 인플루언서의 인생은 반짝반짝 빛나는 것 같은데 현실 속 내 인생은 구질구질해 보이는 순간. 아마 현대인이라면 누구나 느껴본 적이 있을 것이다. 그런 당신에게 누군가 가장 원하는 롤모델의 인생으로 내 인생의 시나리오를 다시 써준다고 제안한다면, 당신은 당신이 가진 모든 것을 걸겠는가?

《나는 범죄조직의 시나리오 작가다》는 완벽한 인생과 행복이라는 힐링 소설의 흔한 주제를 미스터리와 범죄, 환상적인 요소로 풀어낸 독특하고 매력적인 작품이다. 한 편의 영화를 제작하듯 의뢰인의 인생을 ‘연출’한다는 방식은 어디에서도 만나본 적 없는 독창적인 스토리텔링으로 기존의 미스터리 소설과 결을 달리한다.",1,국내도서-소설/시/희곡
166,9791160201116,81702820,서유기 7,"13,500원",750원,오승은 저/홍상훈 등역,솔,"원전에 가장 충실한 정본 완역본!
이야기하듯 풀어낸 삼장 일행의 기상천외한 여행기!

중국문학 연구와 대중화에 앞장서온 홍상훈 교수와 공동 번역자들은 풍부한 자료 조사와 깔끔한 번역을 바탕으로 그동안 접하기 어려웠던 원전 『서유기西遊記』를 독자들에게 생생하게 보여준다. 그 덕분에 우리는 익히 알고 있는 ‘삼장법사’와 ‘손오공’, ‘저팔계’, ‘사오정’이 아닌 전혀 다른 성격의 그들을 만나게 된다.

이번 솔출판사의 『서유기』는 창작 당시의 역사적 사실과 시대상을 반영하는 한편 다양한 판본 비교를 통해 원전 『서유기』의 내용을 온전히 되살렸다. 이를 통해 중생 구제를 위해 불경을 찾으러 떠난다는 도식적인 주제 너머의 핵심적인 내용, 즉 삼장법사와 손오공, 저팔계, 사오정을 둘러싼 흥미로운 다양한 에피소드와 더불어 시공간을 초월하는 우리 인간의 현세적 욕망을 적나라하게 보여준다.
",2,국내도서-소설/시/희곡
167,9788934983323,64975783,소오강호 4,"11,520원",640원,김용 저/전정은 역,김영사,"세상은 정의를 외치지만 추악하다. 권력을 움켜쥐려는 자들은 불의도 서슴지 않는다. 신의를 중시하는 강호 세계도 마찬가지다. 명문 정파든 사파든 다들 정상에 오르기 위해 아닌 척하며 뒤에서 칼을 간다. 권력과 이득을 손에 넣기 위해 수단과 방법을 가리지 않는다. 몇 십 년을 수련한 강호 고수조차 인간의 온갖 더러운 모습을 갖고 있다. 어떤 나라든, 어떤 시대든 화려한 빛깔과 소리에 사로잡혀 눈과 귀를 잃은 사람들은 항상 존재한다. 김용이 『소오강호』를 집필할 때, 중국에서는 문화대혁명과 권력 투쟁이 한창이었다. 당권파와 반란파는 서로 더 큰 힘을 차지하기 위해 물불 가리지 않았고, 그 모습은 믿기 싫지만 믿을 수밖에 없는 인간의 본성을 고스란히 드러냈다. 『소오강호』는 영호충이라는 인물을 내세워 이들의 오만과 어리석음을 풍자하는 이야기다.",2,국내도서-소설/시/희곡
168,9788954624039,12185238,풍아송,"21,600원","1,200원",옌롄커 저/김태성 역,문학동네,"제1, 2회 루쉰문학상과 제3회 라오서문학상을 수상한 옌롄커, 
중국 당대 최초의 지식인 소설로 불리는 문제작

중국 내에서 가장 뜨거운 작가, 폭발력 있는 작가, 쟁의가 가장 많은 작가로 손꼽히는 옌롄커. 그의 국내외 수상 경력과 여러 나라 대학이나 학회에서의 화려한 문학강연 활동을 보면, 이제 그는 전 세계가 주목하는 세계적 작가임에 틀림없다. 1996년 중편 『황금동黃金洞』으로 제1회 루쉰문학상 수상, 1997년 『연월일年月日』로 제2회 루쉰문학상 수상, 2005년 『레닌의 키스受活』로 제3회 라오서문학상 수상 등 자국의 권위 있는 문학상을 휩쓴 것은 물론, 해외에서도 2012년 『딩씨 마을의 꿈』으로 타이완 ‘독서인상’ 수상, 전지구 화어華語 10대 양서 선정, 영국 ‘맨아시아문학상’ 최종후보, 『파이낸셜 타임즈』 ‘올해의 책’ 선정과 더불어 『사서四書』로 프랑스 ‘페미나문학상’ 최종후보로 선정되기도 했다.",1,국내도서-소설/시/희곡
169,9788990220783,2889807,로빙화,"10,800원",600원,중자오정 저/김은신 역 ,양철북,1989년 대만에서 만들어진 영화 의 원작 소설이다. 하늘개가 달을 집어 삼키는 그림을 그리는 시골 학교의 가난한 소년 고아명. 임시 교사 곽운천 미술 선생님에 의해 재능을 인정받지만 끝내 어른들의 편견과 권력 앞에 자신의 꿈을 펼치지도 못하고 죽음을 맞는다. 죽어서 천재성을 인정받아야 했던 미술 천재 소년 고아명의 삶을 서정적으로 표현한 작품이다.,2,국내도서-청소년
170,9788967358587,97163451,도톰한 계란말이,"11,700원",650원,"수차오,서우즈 등저/김택규 역",글항아리,"대도시의 사랑과 절망, 질주하는 청춘들
중국 바링허우 대표작가 단편선 

묘보설림 시리즈 제14권 『도톰한 계란말이』 출간

바링허우(1980년대 이후생) 젊은 작가 작품 일곱 편을 번역한 『도톰한 계란말이』는 오늘날 변화된 중국 대도시의 삶에서 살아가는 청춘들의 삶을 잘 보여주고 있다. 우리와는 다른, 중국만의 사회적 맥락 속에서 만들어진 이들의 사랑과 이별, 삶에 대한 투지와 절망은 묘하게 낯선 이그러진 자화상을 보는 것 같기도 하고, 그러면서도 어떤 장면에서는 깊은 공감을 불러오기도 한다.",1,국내도서-소설/시/희곡
171,9791156621225,18235213,만 마디를 대신하는 말 한 마디,"12,150원",670원,류전윈 저/김태성 역,아시아,"위화, 옌렌커, 쑤퉁과 함께 전 세계에 가장 널리 알려진 중국 최고의 사실주의 작가, 류전윈의 가장 성숙하고 호방한 작품으로 꼽는 말 한 마디 때문에의 2부이자 스핀오프격인 『만 마디를 대신하는 말 한 마디』가 한국 독자들을 찾아왔다. 작가가 3년의 시간과 공력을 들여 완성한 작품으로, ‘가장 성숙한 작품’으로 평가된다. 
2009년 중국 문단을 가장 뜨겁게 달군 두 권의 책이 바로 류전윈의 『만 마디를 대신하는 말 한 마디』와 옌렌커의 『풍아송』이다. 특히 『만 마디를 대신하는 말 한 마디』는 당대 향토 서사의 가장 대표적인 작품으로, 류전윈이 중국 문단에서 가장 문제적 작가로 자리매김하는 결정적인 역할을 했다. 
류전윈은 “문학이 한 민족과 다른 민족들 사이의 차이를 쓰는 것”이라고 말한다. 그러며 “서로 다르다는 것을 알아야 세계가 같다는 것을 알 수 있고, 서로 같다는 것을 알아야 세계가 다른 지도 알 수 있”다고 고백한다.",2,국내도서-소설/시/희곡
172,9788967359683,105107911,막,"11,700원",650원,지다웨이 저/문희정 역,글항아리,"황폐화된 육지를 떠나 해저로 이주한 2100년의 인류
국적이나 성적 지향에 구애받지 않는 미래 사회
타이완 퀴어 SF 문학의 진수 지다웨이紀大偉 대표작

『막膜』은 타이완 퀴어 문학의 대표작으로 1995년 제17회 롄허보 문학상 중편소설 대상 수상작이다. 일본과 프랑스에서 번역 출간됐고, 올해 10월 미국의 컬럼비아대학출판사를 통해 정식 출판되었다. 타이완의 퀴어 문학은 타이완 문학의 독자성과 진보성을 잘 드러내는 영역으로 작가와 작품이 질적으로나 양적으로 이미 상당한 수준에 이르렀는데, 지다웨이는 이 흐름의 선두에 있는 작가다. 그는 경직된 유교 전통 사회의 금기에 당당히 맞서는 유머러스하면서도 날카로운 문체로 기존의 퀴어 문학과 차이를 드러냈으며, 2017년 세계적으로 유례없는 『퀴어 문학사同志文學史』를 집필해 타이완 문학사에 한 획을 그었다.

『막』은 독특하고 예리한 시선으로 2100년의 지구를 그린 SF소설이다.",2,국내도서-소설/시/희곡
173,9791160201123,81702885,서유기 8,"13,500원",750원,오승은 저/홍상훈 등역,솔,"원전에 가장 충실한 정본 완역본!
이야기하듯 풀어낸 삼장 일행의 기상천외한 여행기!

중국문학 연구와 대중화에 앞장서온 홍상훈 교수와 공동 번역자들은 풍부한 자료 조사와 깔끔한 번역을 바탕으로 그동안 접하기 어려웠던 원전 『서유기西遊記』를 독자들에게 생생하게 보여준다. 그 덕분에 우리는 익히 알고 있는 ‘삼장법사’와 ‘손오공’, ‘저팔계’, ‘사오정’이 아닌 전혀 다른 성격의 그들을 만나게 된다.

이번 솔출판사의 『서유기』는 창작 당시의 역사적 사실과 시대상을 반영하는 한편 다양한 판본 비교를 통해 원전 『서유기』의 내용을 온전히 되살렸다. 이를 통해 중생 구제를 위해 불경을 찾으러 떠난다는 도식적인 주제 너머의 핵심적인 내용, 즉 삼장법사와 손오공, 저팔계, 사오정을 둘러싼 흥미로운 다양한 에피소드와 더불어 시공간을 초월하는 우리 인간의 현세적 욕망을 적나라하게 보여준다.
",1,국내도서-소설/시/희곡
174,9788952752413,3006845,전쟁쓰레기,"11,700원",650원,하진 저/왕은철 역,시공사,"'현존하는 작가 중 노벨 문학상에 가장 근접한 작가'라 불리는 하 진 문학의 정수를 보여주는 소설 『전쟁쓰레기 War Trash』. 펜 포크너상 수상작이자, 퓰리처상 최종 후보에 올랐던 작품이다. 하진은 이 작품으로 자신의 첫 번째 장편소설이자 출세작인 『기다림 Wating』에 이어 두번째로 펜 포크너상을 수상하게 되었는데, 이는 지극히 보수적이며, 특히 외국인에게 배타적인 미국 문단에서 극히 이례적인 일이라 할 수 있다.",2,국내도서-소설/시/희곡
175,9791160201086,81702499,서유기 4,"13,500원",750원,오승은 저/홍상훈 등역,솔,"원전에 가장 충실한 정본 완역본!
이야기하듯 풀어낸 삼장 일행의 기상천외한 여행기!

중국문학 연구와 대중화에 앞장서온 홍상훈 교수와 공동 번역자들은 풍부한 자료 조사와 깔끔한 번역을 바탕으로 그동안 접하기 어려웠던 원전 『서유기西遊記』를 독자들에게 생생하게 보여준다. 그 덕분에 우리는 익히 알고 있는 ‘삼장법사’와 ‘손오공’, ‘저팔계’, ‘사오정’이 아닌 전혀 다른 성격의 그들을 만나게 된다.

이번 솔출판사의 『서유기』는 창작 당시의 역사적 사실과 시대상을 반영하는 한편 다양한 판본 비교를 통해 원전 『서유기』의 내용을 온전히 되살렸다. 이를 통해 중생 구제를 위해 불경을 찾으러 떠난다는 도식적인 주제 너머의 핵심적인 내용, 즉 삼장법사와 손오공, 저팔계, 사오정을 둘러싼 흥미로운 다양한 에피소드와 더불어 시공간을 초월하는 우리 인간의 현세적 욕망을 적나라하게 보여준다.
",2,국내도서-소설/시/희곡
176,9788937604096,15476256,삼국연의 1,"12,150원",140원,나관중 원저/모종강 편,비봉출판사(BBbooks),"『삼국연의』제1권. 본서의 가장 중요한 특징은, 《나관중 원저, 모종강 평론·개정》의 《모종강본 삼국(지)연의》를 평론과 협평 등을 포함해 국내 최초로 완역한 책이라는 것이다. 《모종강본 삼국(지)연의》의 전체 원문과 원문에 대한 주석을 달아 놓음으로써(제9권~12권) 《삼국(지)연의》를 통해 한문 공부나 중문학을 공부하려는 독자들의 편의를 도모하였다.",2,국내도서-소설/시/희곡
177,9791190254335,125294089,웨이스트 타이드 (Waste Tide),"16,200원",900원,천추판 저/이기원 역,에디토리얼,"“여기에 들어오는 자, 모든 희망을 버려라.”
환경 재앙이 그리는 지옥도

광둥성 동부의 항구 도시 산터우로부터 내륙으로 만입하는 곳에 ‘실리콘섬’이 있다. 폐기된 전자제품에서 재활용 가능한 부품을 뜯어내서 가공하는 작업장과 공장이 밀집해 있다. 세계 각지에서 실려 온 전자 폐기물과 폐플라스틱이 이 섬에서 해체, 처리, 재가공된다. 분류와 해체 작업은 오로지 사람, 이곳 토박이들이 ‘쓰레기인간’이라 부르는 외지 노동자들의 눈과 코, 손으로 이뤄진다. 현지인과 외지인 모두 이 섬에서 돈 한 푼 더 버는 데 혈안일 뿐 공통적으로 이 섬을 혐오한다.

여자들은 시커먼 물에 맨손으로 빨래하고, 아이들은 플라스틱 잿더미 위에서 점프하며 놀거나 폴리에스터 필름이 둥둥 떠다니는 검푸른 연못에서 헤엄치며 장난친다. 불리한 자연조건을 극복하려 선조들의 지혜로 건설된 관개수로와 지형물들은 깨진 디스플레이와 플라스틱 쓰레기로 가득하거나 회로기판 따위를 녹여내는 산성 용액 웅덩이로 변했다.",1,국내도서-소설/시/희곡
178,9788934920724,123180705,의천도룡기 2,"13,320원",740원,김용 저/임홍빈 역,김영사,"“무림지존 도룡도와 의천검을 차지한 자가 세상을 지배한다!”
오천 년 동양의 지혜와 문화를 꿰뚫는 〈사조삼부곡〉의 완결판

원명 교체기라는 혼란한 시대에 격랑 많은 운명을 타고난 장무기가 절대 무공 비법을 통해 강호 최고의 고수가 되기까지의 파란만장한 모험기를 담은 김용의 대표작 『의천도룡기』 정식 완역본! 천하무적의 병기로 알려진 ‘의천검’과 ‘도룡도’를 둘러싸고 벌어지는 수많은 무림 고수들의 혈투, 명교인과 육대문파 간의 오랜 은원관계, 장무기와 펼치는 조민, 주지약, 아소, 은리의 로맨스 등 다양한 사건과 애끓는 사연이 강호를 수놓는다. 웅장한 역사와 탁월한 상상력, 생생한 캐릭터와 치밀한 구성, 박진감 넘치는 묘사와 높은 완성도로 뜨거운 찬사를 받은 무협소설 마니아들의 필독서! 진정한 영웅들의 의리와 고뇌, 사랑이 우리 가슴속에서 뜨겁게 부활한다.",2,국내도서-소설/시/희곡
179,9788936474201,56018242,삼국지 2 (큰글자도서),"17,000원",원,나관중 저/황석영 역,창비,"영원한 고전 『삼국지』가 황석영의 손을 빌려 새롭게 태어났다. 『장길산』 『객지』 등을 통해 입증된 유려하고 장쾌한 글솜씨와 작가 특유의 민중적 역사의식이 돋보인다. 총 210수의 한시를 정갈하게 다듬어 넣었으며, 현대적으로 깔끔하게 다듬어진 문장으로 긴 호흡의 이야기를 밀도있게 풀어냈다. 

정역본답게 원문의 간결하고 사실적인 문체를 최대한 살리되, 중요한 전투장면 등에는 박진감 넘치는 묘사를 덧붙였다. 1999년 샹하이 강소고적출판사에서 나온 『수상삼국연의』를 원전으로 삼아 번역했으며, 중국 고대인물화의 권위자 왕홍시 화백의 컬러삽화 150여장이 책의 풍치를 더한다.",2,국내도서-소설/시/희곡
180,9788954605694,2937133,청의(靑衣),"12,420원",690원,비페이위 저/김은신 역,문학동네,"국내에 처음으로 소개되는 중국 소설가 비페이위(畢飛宇)의 소설집. 비페이위는 서사성, 진정성, 해학미라는 중국문학의 오랜 전통을 충실히 따르면서도 자유분방한 상상력과 환상성을 앞세운 문학적 실험을 구사하는 작가이다. 특히 거대한 역사의 흐름과 끊임없이 반목하는 개인적인 욕망의 결을 적나라하게 드러내는 것을 좋아하는 비페이위는, 중국문단 내에서 리얼리즘의 어법과 포스터모더니즘의 어법을, 사회주의적 가치와 자유주의적 가치를 자유자재로 넘나들 수 있는 몇 안 되는 작가에 속한다.",1,국내도서-소설/시/희곡
181,9788974161927,2930197,삼국지 2,"8,550원",470원,나관중 저/박태원 역,깊은샘,"『소설가 구보씨의 일일』로 유명한 작가 박태원이 완역한 삼국지. 1950년 박태원의 월북으로 중단되었던 『삼국지』가 무려 58년만에 돌아온 셈이다. 이번에 나온 박태원의 삼국지 완역본은 1959년 북한의 국립문학예술서적출판사에서 번역, 출판하기 시작하여 1964년 조선문학예술총동맹출판사에서 총 6권 분량으로 완결된 판본을 저본으로 한 것으로 박태원 삼국지의 결정판이라 할 수 있다.",7,국내도서-소설/시/희곡
182,9788932040523,113790313,"캄캄한 낮, 환한 밤","17,100원",360원,옌롄커 저/김태성 역,문학과지성사,"“생명은 고되고 짧은데
욕망은 무한히 길다
하지만 하지만”

세계가 주목한 “가장 폭발력 있는 중국 작가”처연하면서도 성숙한 옌롄커 문학의 전환

2022년 제6회 이호철통일로문학상 수상자, 현재 중국에서 노벨문학상에 가장 가까운 작가 옌롄커 문학의 새로운 전환을 보여주는 장편소설『캄캄한 낮, 환한 밤』이 문학과지성사 대산세계문학총서 178번으로 출간되었다. 50세 생일 전날 밤 신의 선물과도 같이 한 작가의 머릿속에 번뜩인 생각! ‘이 이야기로 영화를 만들어서 글쓰기의 적막과 가난으로부터 벗어나 세계 영화예술의 거장이 돼보자!’

『캄캄한 낮, 환한 밤』은 이 작품의 실제 작가이자 주인공인 유명 소설가 옌롄커가 고향 사람 리좡의 삶과 신기한 사랑 이야기로 영화화를 시도하는 과정을 담고 있다.",2,국내도서-소설/시/희곡
183,9788925578118,110369733,이문열 삼국지 1 (큰글자책),"28,000원",원,나관중 저/이문열 평역/정문 그림,알에이치코리아(RHK),"더 크게, 더 새롭게 읽는 이문열 『삼국지』 큰글자판 출간!
판형과 글자 크기를 키워 가독성을 높이고, 
새로운 표지와 종이 재질로 고급스러움을 더한 『삼국지』 전10권 특별판!

누적판매 2,000만 부가 넘은 『이문열 삼국지』가 큰글자판으로 출간됐다. “삼국지를 세 번 이상 읽지 않은 자와 인생을 논하지 말고 열 번 이상 읽은 자와 감히 상대하지 마라”는 말이 있듯이 삼국지는 곁에 두고 곱씹으면서 읽어야 할 고전 중의 고전이다. 읽을수록 그 진가를 발휘하는 『이문열 삼국지』의 애독자를 위해 이번에 판형과 글자 크기를 키워 가독성을 높이고, 표지디자인과 종이 재질을 바꿔 곁에 두고 몇 번을 읽더라도 책의 고급스러움을 유지할 수 있도록 했다. 더 크게, 더 새롭게 읽는 삼국지 큰글자판 전10권! 이문열의 깊이 있는 명문장을 글자와 판형이 커진 만큼 더 여유 있게 곱씹어 읽어보자.
",2,국내도서-소설/시/희곡
184,9791160201109,81702677,서유기 6,"13,500원",750원,오승은 저/홍상훈 등역,솔,"원전에 가장 충실한 정본 완역본!
이야기하듯 풀어낸 삼장 일행의 기상천외한 여행기!

중국문학 연구와 대중화에 앞장서온 홍상훈 교수와 공동 번역자들은 풍부한 자료 조사와 깔끔한 번역을 바탕으로 그동안 접하기 어려웠던 원전 『서유기西遊記』를 독자들에게 생생하게 보여준다. 그 덕분에 우리는 익히 알고 있는 ‘삼장법사’와 ‘손오공’, ‘저팔계’, ‘사오정’이 아닌 전혀 다른 성격의 그들을 만나게 된다.

이번 솔출판사의 『서유기』는 창작 당시의 역사적 사실과 시대상을 반영하는 한편 다양한 판본 비교를 통해 원전 『서유기』의 내용을 온전히 되살렸다. 이를 통해 중생 구제를 위해 불경을 찾으러 떠난다는 도식적인 주제 너머의 핵심적인 내용, 즉 삼장법사와 손오공, 저팔계, 사오정을 둘러싼 흥미로운 다양한 에피소드와 더불어 시공간을 초월하는 우리 인간의 현세적 욕망을 적나라하게 보여준다.
",2,국내도서-소설/시/희곡
185,9791160201093,81702543,서유기 5,"13,500원",750원,오승은 저/홍상훈 등역,솔,"원전에 가장 충실한 정본 완역본!
이야기하듯 풀어낸 삼장 일행의 기상천외한 여행기!

중국문학 연구와 대중화에 앞장서온 홍상훈 교수와 공동 번역자들은 풍부한 자료 조사와 깔끔한 번역을 바탕으로 그동안 접하기 어려웠던 원전 『서유기西遊記』를 독자들에게 생생하게 보여준다. 그 덕분에 우리는 익히 알고 있는 ‘삼장법사’와 ‘손오공’, ‘저팔계’, ‘사오정’이 아닌 전혀 다른 성격의 그들을 만나게 된다.

이번 솔출판사의 『서유기』는 창작 당시의 역사적 사실과 시대상을 반영하는 한편 다양한 판본 비교를 통해 원전 『서유기』의 내용을 온전히 되살렸다. 이를 통해 중생 구제를 위해 불경을 찾으러 떠난다는 도식적인 주제 너머의 핵심적인 내용, 즉 삼장법사와 손오공, 저팔계, 사오정을 둘러싼 흥미로운 다양한 에피소드와 더불어 시공간을 초월하는 우리 인간의 현세적 욕망을 적나라하게 보여준다.
",1,국내도서-소설/시/희곡
186,9791156620884,17080180,말 한 마디 때문에,"13,320원",740원,류전윈 저/김태성 역,아시아,"‘20세기 100대 세계명작’으로 선정되기도 한 [닭털 같은 나날]이 국내에 두 번째로 소개된 이후 4년의 시간이 흘렀다. 2015년, 국내에 소개되는 류전윈 작가의 다섯 번째 작품이자 가장 성숙하고 호방한 작품으로 꼽는 [말 한 마디 때문에]가 드디어 한국 독자들을 찾아왔다. 

작가가 3년의 시간과 공력을 들여 완성한 작품으로, ‘가장 성숙한 작품’으로 평가된다. 세련된 언어와 간결하고 직접적인 구성을 보이고 있어, 이전 세대 거장들의 유풍을 계승한 듯한 인상을 준다. 이 소설의 가장 큰 특징은 심혈을 기울여 다듬은 작가 특유의 언어와 이에 대응하는 작품의 내포에 있다. 

위화, 옌렌커, 쑤퉁과 함께 전 세계에 가장 널리 알려진 중국 최고의 사실주의 작가, 류전윈은 “문학이 한 민족과 다른 민족들 사이의 차이를 쓰는 것”이라고 말한다.",2,국내도서-소설/시/희곡
187,9788937604102,15476259,삼국연의 2,"12,150원",130원,나관중 원저/모종강 편,비봉출판사(BBbooks),"『삼국연의』제2권. 본서의 가장 중요한 특징은, 《나관중 원저, 모종강 평론·개정》의 《모종강본 삼국(지)연의》를 평론과 협평 등을 포함해 국내 최초로 완역한 책이라는 것이다. 《모종강본 삼국(지)연의》의 전체 원문과 원문에 대한 주석을 달아 놓음으로써(제9권~12권) 《삼국(지)연의》를 통해 한문 공부나 중문학을 공부하려는 독자들의 편의를 도모하였다.",2,국내도서-소설/시/희곡
