순위,ISBN,상품번호,상품명,판매가,YES포인트,저자,출판사,설명,출고예상일,관리분류
291,9788937463037,7929051,레 미제라블 3,"11,700원",650원,빅토르 위고 저/정기수 역,민음사,"「장 발장」으로도 잘 알려진, 19세기 프랑스 대문호 빅토르 위고의 대표작이자
역사, 사회, 철학, 종교, 인간사의 모든 것을 축적한 세기의 걸작

“한 저주받은 비천한 인간이 어떻게 성인이 되고, 어떻게 예수가 되고, 어떻게 하느님이 되는”지 그려 낸 『레 미제라블』은 빅토르 위고가 삼십오 년 동안 마음속에 품어 오던 이야기를 십칠 년에 걸쳐 완성해 낸 세기의 걸작이다. 워털루 전쟁, 왕정복고, 폭동이라는 19세기 격변을 다룬 역사 소설이자 당시 사람들의 지난한 삶과 한을 담은 민중 소설이며, 사상가이자 시인으로서의 철학과 서정이 담긴 작품이기도 한 이 소설은 그 자체로 “하나의 거대한 세계”나 다름없으며 인간 삶과 세상을 아우르는 모든 것이 이 작품 속에 담겨 있다. 

무식하고 가난한 시골 일꾼 장 발장이 촛대를 훔치려던 자신을 용서해 준 미리엘 주교의 신뢰와 사랑에 새로운 삶을 결심하는 것으로 시작하는 이 이야기는 자기 희생과 속죄를 통해 성인(聖人)으로 거듭나는 한 인간의 삶을 보여준다. 출판되자마자 폭발적인 반향을 일으키고, 프랑스에서 성경 다음으로 많이 읽힌다는 평가까지 받는 이 작품은 몇 세기에 걸쳐 오늘날까지 수없이 영화, 뮤지컬, 어린이들을 위한 번안판으로 변주되며 사랑받아 온 19세기 프랑스 최고의 위대한 소설이라고 할 수 있을 것이다.

민음사에서 총 5권으로 출간되는 『레미제라블』은 원로 불문학자 정기수가 원문(NELSON EDITEURS, Paris, 1956/Classiques Larousse 문고본)과 하나하나 대조하여 새로이 번역하다시피 하여 탄생한 것으로, 국내 빅토르 위고 번역의 시작이자 마지막이 될 작품이라 할 수 있을 것이다.",1,국내도서-소설/시/희곡
292,9788937403897,265748,몬테크리스토 백작 4,"14,400원",800원,알렉상드르 뒤마 저/오증자 역,민음사,"에드몽 당테스는 19살 어린 나이에 파라옹호의 선장으로 임명되었다. 마침 그날은 그의 약혼식이 있던 날. 아름다운 약혼녀와 성공을 눈 앞에 둔 그에게 닥쳐온 운명은 믿을 수 없을 만큼 가혹한 것이었다. 정치범으로 낙인찍혀 악명높은 이프 감옥에 던져진 것이다.

나폴레옹과 부르조아 영웅들의 시대 1845년, 알렉상드르 뒤마는 자신의 대표작을 탈고한다...",1,국내도서-소설/시/희곡
293,9788932012636,215499,은밀한 생,"13,500원",750원,파스칼 키냐르 저/송의경 역,문학과지성사,"2000년 '아카데미 프랑세즈 소설 대상'을 수상하면서 ""문학사에 기록될 만한 프랑스 현존 작가 중의 하나""라는 평가를 받은 파스칼 키냐르의 작품이다. 이 작품은 소설도 자서전도 철학 에세이도 심리 분석도 명상록도 이야기도 아니면서 동시에 그 모두이기도 하다. 최근 프랑스 문학의 동향을 철학과 문학의 사이, 시와 산문의 사이, 연대기, 자아에 대한 글...",1,국내도서-소설/시/희곡
294,9791190489737,116751962,오페라의 유령,"15,300원",850원,가스통 르루 저/김주경 역/이예나 삽화,북레시피,"소설 속 주요 장면을 생생히 그려낸 80장의 연필화와
프랑스어판 원작의 감동을 그대로 옮겨낸 새로운 『오페라의 유령』

『오페라의 유령』은 이미 여러 판본이 나와 있고 영화나 연극, 뮤지컬로도 여러 차례 소개된 바 있지만, 이번에 북레시피에서 신간으로 선보이는 『오페라의 유령』은 무려 80편의 일러스트를 담아 다른 판본과의 차별점을 확연히 하고 있다. 실제 있었던 사건을 기반으로 쓴 『오페라의 유령』은 ‘파리 오페라 극장’, ‘프랑스 국립 음악아카데미’, ‘오페라 가르니에’, ‘가르니에 궁’ 등등의 이름으로 불리는 파리의 유서 깊은 극장 건물을 무대로 벌어지는 비극적 사랑 이야기이다. 소설의 줄거리와 주요 장면마다 다채롭게 묘사된 일러스트들을 따라 독자는 오페라 극장의 발코니석에서 무대를 바라보는 것 같은 착각을 불러일으킬 만한 색다른 감동을 만끽할 수 있을 것이다.",1,국내도서-소설/시/희곡
295,9791191861075,109319325,충실한 마음,"14,400원",800원,델핀 드 비강 저/윤석헌 역,레모출판사,"밀리언셀러 소설가, 델핀 드 비강의 3년 만의 신작. 
인간관계에 대한 짧은 소설 시리즈 그 첫 번째. 

문학성과 대중성을 갖춘 동시대 최고의 프랑스 소설가 델핀 드 비강이 『충실한 마음』으로 돌아왔다. 델핀 드 비강은 2001년 『배고픔 없는 날들』로 데뷔한 이후, 두 권의 밀리언셀러 『길 위의 소녀』와 『내 어머니의 모든 것』을 비롯해서 총 8권의 소설로 프랑스 내에서만 3백만 부 이상의 판매고를 기록했으며, 전 세계 40여 개국에 번역 출간되었다. 더불어 르노도상, 고등학생이 뽑은 공쿠르상 등 유수의 문학상을 수상했다. 작가로서의 빼어난 이력을 갖춘 델핀 드 비강이 3년 만에 인간관계에 대한 짧은 소설 시리즈를 발표하며 전 세계 독자들의 주목을 받고 있다. 그 첫 번째 소설이 바로 2018년 1월 출간 두 달 만에 16만 부가 팔린 『충실한 마음』이다.",2,국내도서-소설/시/희곡
296,9791189581985,66985543,별 미니미니북,"3,510원",190원,알퐁스 도데 저,더클래식,,1,국내도서-소설/시/희곡
297,9788937485640,12659226,잃어버린 시간을 찾아서 4,"15,300원",850원,마르셀 프루스트 저/김희영 역,민음사,"국내 최고의 프루스트 번역서, 후속편 출간   
『잃어버린 시간을 찾아서』, 그 두 번째 이야기, 「꽃핀 소녀들의 그늘에서」
 한 섬세한 소년의 예술과 사랑과 세상에 대한 내밀한 체험

1편 「스완네 집 쪽으로」에 이어서 『잃어버린 시간을 찾아서』 3, 4권으로 출간된 2편 「꽃핀 소녀들의 그늘에서」는 1919년 프랑스 갈리마르 출판사에서 출간되어 프루스트에게 공쿠르 상의 영예를 안겨 준 작품이다. 

꽃과 그늘의 대조를 함축하는 「꽃핀 소녀들의 그늘에서」는, “지금은 활짝 핀 소녀들이지만 언젠간 시들고 늙어 망각으로 추락할 존재라는 점에서 중요한 ‘시간’이라는 주제를 잘 드러내며, 더 나아가 밝음과 어둠이라는 명암 대비와 시간의 흐름 속에 포착된 덧없는 이미지의 구현”을 아름답게 실현해 낸 작품으로 평가받는다. 

『잃어버린 시간을 찾아서』가 한 마디로 요약해 한 소년이 작가가 되어 가는 과정, 그리고 사랑과 우정을 통해 성장해 나가는 과정을 그린 작품이라면, 「꽃핀 소녀들의 그늘에서」는 화자에게 문학적 영감을 주는 두 스승, 작가 베르고트, 화가 엘스티르와 더불어 화자의 인생에서 가장 큰 사랑이 될 소녀 알베르틴과 만나는 주요한 이야기를 다루며 화자에게 새로운 세상을 펼쳐 보인다.",2,국내도서-소설/시/희곡
298,9788982812392,103362,꼬마 니콜라 세트,"51,750원","2,870원",르네 고시니 글/장자크 상페 그림/윤경 역,문학동네,"르네 고시니가 글을 쓰고 장 자끄 상뻬가 처음으로 삽화를 넣은 웃음과 희망의 그림 이야기책. 상뻬의 정감어린 수채화풍의 삽화를 우리 나라에 알린 책이 '좀머씨 이야기'라면, 이 책은 장 자끄 상뻬의 존재를 전 세계에 최초로 부각시킨 책이다. 꼬마 악동 니콜라와 개구장이 친구들이 벌이는 갖가지 괴상하고 우스꽝스런 에피소드를 통해 천진난만하고 순진무구한 ...",1,국내도서-소설/시/희곡
299,9788954624107,12328986,인간 짐승,"18,900원","1,050원",에밀 졸라 저/이철의 역,문학동네,"위대한 리얼리스트 에밀 졸라의 
충격과 논란의 화제작 국내 초역!

문학동네에서 국내 최초로 소개하는 에밀 졸라의 충격적 문제작『인간 짐승』(1890년 작)은 자연주의 문학의 절정을 이루는 ‘루공마카르’ 총서 스무 권 중 열일곱번째 작품이다. 루공마카르 총서는 유전(‘자연적 역사’)과 환경(‘사회적 역사’)이라는 과학적 방법론으로 제2제정기 프랑스 사회를 낱낱이 해부해 객관적인 모습을 그대로 드러내 보이겠다는 포부로 기획되었다. 1871년부터 1893년까지 거의 매년 한 권꼴로 출간된 루공마카르 총서의 동력은 바로 “분노하며 살 것, 한 줄이라도 쓰지 않으면 하루라도 살지 말 것”을 좌우명으로 삼았던 졸라의 지칠 줄 모르는 열정이었다.",1,국내도서-소설/시/희곡
300,9788937461859,3058365,나자,"10,800원",600원,앙드레 브르통 저/오생근 역,민음사,"앙드레 브르통이 1926년 10월 4일 파리의 한 거리에서 우연히 만난 매혹적인 여성 나자와 몇 개월간의 만남을 통해 체험한 실제 이야기와 특이한 경험을 소설로 기록한 책 『나자』. 앙드레 브르통이 사실주의 소설가들의 평면적인 묘사와 결정론적인 심리분석을 비판하고 현실성 있는 진정한 삶을 전달해야 한다고 주장하고 난 후 발표한 소설로, 일상에 대한 초현실주의자들의 태도를 핵심적으로 드러내 주는 작품이다.

이 소설은 기존의 소설 문법과는 많이 달리, 실제 사건과 진실만을 토대로 쓰여져 있다.",1,국내도서-소설/시/희곡
301,9788937464164,115190310,제르미날 1,"12,600원",700원,에밀 졸라 저/강충권 역,민음사,"에밀 졸라의 대표작 ‘루공 마카르 총서’ 스무 권 가운데서도 최고의 작품으로 손꼽히는 『제르미날』이 민음사 세계문학전집으로 출간되었다. 에밀 졸라는 1871년부터 1893년까지 이십여 년에 걸쳐 총 스무 권으로 구성된 ‘루공 마카르 총서’를 완성했다. 한 가족의 역사를 다룬 이 총서를 통해 에밀 졸라는 프랑스 제2제정 시대의 사회와 다양한 인간 군상의 모습을 탁월하게 묘사했다. 

총서의 열세 번째 소설로서 자연주의 문학의 걸작으로 평가받는 『제르미날』은 일곱 번째 작품인 『목로주점』과 더불어 에밀 졸라의 작품 가운데 가장 많이 읽힌 작품이다.",1,국내도서-소설/시/희곡
302,9788952763006,5735557,삼총사 2,"14,400원",800원,알렉상드르 뒤마 저/김석희 역,시공사,"“하나는 모두를 위하여, 모두는 하나를 위하여”

1911년, 원작을 바탕으로 한 무성영화가 처음 만들어진 이래, 지금도 영화와 뮤지컬로 끊임없이 재탄생되고 있는, 설명이 필요 없는 모험소설의 대명사, 삼총사. 기존에 출간된 『삼총사』는 어린이용 축약본 위주여서 『삼총사』의 재미를 오롯이 느낄 수 없었다. 이 책 『삼총사』는프랑스어, 영어, 일본어 번역이 모두 가능한 번역가가 정본으로 평가받는 갈리마르의 폴리오 클라시크 프랑스어 판본은 물론, 각 언어의 훌륭한 판본을 모두 참고하여, 우리말의 글맛을 살려 ?..",2,국내도서-소설/시/희곡
303,9788932924052,124702365,신 1,"15,120원",840원,베르나르 베르베르 저/이세욱 역,열린책들,"베르베르 특유의 상상력으로 빛나는 최고의 대작

계획부터 집필에 걸린 시간만 9년에 달하는 베르베르 생애 최고의 대작 『신』이 새로운 판형과 표지를 갖추고 독자들을 찾아왔다. 그리스·로마 신화를 바탕으로 기독교와 유대교 전승을 더하고 거기에 불교적 세계관을 결합하여 인류의 역사를 재조명하려는 야심 찬 계획의 산물인 『신』은 프랑스와 한국에서 도합 300만 부 이상 판매되며 베르베르의 놀라운 저력을 다시 한번 증명했다. 새롭게 출간되는 『신』은 시대에 맞추어 책의 만듦새를 변경했다. 본문 또한 일부 가다듬고 그간의 맞춤법 변화를 반영했다.",1,국내도서-소설/시/희곡
304,9788937464171,115190319,제르미날 2,"12,600원",700원,에밀 졸라 저/강충권 역,민음사,"에밀 졸라의 대표작 ‘루공 마카르 총서’ 스무 권 가운데서도 최고의 작품으로 손꼽히는 『제르미날』이 민음사 세계문학전집으로 출간되었다. 에밀 졸라는 1871년부터 1893년까지 이십여 년에 걸쳐 총 스무 권으로 구성된 ‘루공 마카르 총서’를 완성했다. 한 가족의 역사를 다룬 이 총서를 통해 에밀 졸라는 프랑스 제2제정 시대의 사회와 다양한 인간 군상의 모습을 탁월하게 묘사했다. 

총서의 열세 번째 소설로서 자연주의 문학의 걸작으로 평가받는 『제르미날』은 일곱 번째 작품인 『목로주점』과 더불어 에밀 졸라의 작품 가운데 가장 많이 읽힌 작품이다.",1,국내도서-소설/시/희곡
305,9791160804157,110094420,그녀와 그,"12,600원",700원,조르주 상드 저/조재룡 역,휴머니스트,"사랑에 모든 것을 걸었던 세기의 연인들,
사랑과 사랑을 둘러싼 세계의 모든 감정들

음악가인 프레데리크 쇼팽을 비롯해 일평생 수많은 남자와 경계 없이 교류하며 ‘사랑의 화신’이라 불린 조르주 상드와 프랑스 낭만주의를 대표하는 천재 시인 알프레드 드 뮈세의 실제 사랑 이야기를 바탕으로 쓰인 작품. 국내 초역. 상드와 뮈세는 격정적인 사랑에 빠져 오직 사랑하는 자들만이 느낄 수 있는 다채로운 감정을 경험한다. 사랑의 환희에 사로잡힌 두 주인공이 이탈리아로 여행을 떠나 주고받는 황홀하고 우스꽝스럽고 집요한 대화 속에 그 모든 과정이 고스란히 담겨 있다. 『그녀와 그』는 주인공들의 유명세에 힘입어 출간되자마자 큰 성공을 거두었으며, 뮈세가 상드와의 이야기를 소재로 먼저 출간한 『세기아의 고백』에 이어 또 한 번 프랑스 문단에 커다란 스캔들을 불러일으킨 작품이다.",1,국내도서-소설/시/희곡
306,9788932921112,102086653,나의 여왕,"11,520원",640원,장바티스트 앙드레아 저/양영란 역,열린책들,"따뜻한 만큼 잔인하고, 슬픈 만큼 다정한
소년 소녀의 별나고 심술궂은 첫사랑 앓이

프랑스 프로방스의 인적 드문 외진 곳의 낡은 주유소집 아들 ‘나’는 학교를 중퇴하고 부모를 도우며 살고 있지만, 어느 날 가출을 결심한다. 부모가 자신을 ‘시설’에 보내는 게 어떻겠느냐는 주변의 이야기를 언급하는 대화를 엿듣고 나서이다. “더 이상 저 몸집 큰 아이를 데리고 있을 수 없다”는 부모의 지나가는 푸념을 듣고 ‘이번 기회야 말로 자신이 어른임을 증명할 기회’라며 뉴스에서 매일 나오는 전쟁터(알제리 독립 전쟁으로 추정)로 가서 훈장을 받아오겠노라고 다짐한다. 그렇게 짐을 챙겨 가출 후 산속을 며칠 동안 헤매던 중 정신을 잃는다. 얼마가 지났을까. 눈을 뜨니 한 여자아이가 ‘나’를 보고 있다. 그 아이의 이름은 비비안, 그 이후 며칠 동안 비비안은 ‘나’를 찾아 음식이나 필요한 물건들을 가지고 산속으로 와주었고, 그렇게 둘은 친구가 되며 신선한 우정을 경험한다.",1,국내도서-소설/시/희곡
307,9788982811364,43060,나폴레옹 3,"12,600원",700원,막스 갈로 저/임헌 역,문학동네,8만여 종이나 되는 나폴레옹에 관한 책 중에서 근래 최고의 작품으로 뽑이는 막스 갈로의 나폴레옹 그 첫권. 역사학자 이기도 한 갈로는 나폴레옹의 내면에 깊은 관심을 두고 매순간 자신이 바로 나폴레옹이 되어 이야기를 풀어나가고 있다.출간되자 프랑스에서 3백만부 이상 팔려 베스트셀러가 된 화제작.,1,국내도서-소설/시/희곡
308,9788932042428,125830644,부영사,"10,800원",600원,마르그리트 뒤라스 저/최윤 역,문학과지성사,"“나는 그녀를 슬픔으로 이해할 겁니다.”
부영사는 말한다.

‘고통’이라는 이 세계를 가로지르는 3악장의 불협화음!
마르그리트 뒤라스의 작품 세계를 관통하는 
상실과 파괴, 외침과 눈물의 서사

프랑스 현대 문학을 대표하는 작가이자 전위적이고 여성적 글쓰기로 작품과 삶 모두에서 우리를 매료시킨 마르그리트 뒤라스의 『부영사』가 소설가 최윤의 번역으로 ‘문지 스펙트럼’ 시리즈로 출간되었다. 인물과 사건, 감정과 심리의 흐름을 극도로 섬세하고 함축적인 언어로 표현하며 독자적인 작품 세계를 구축해온 뒤라스의 문학적 행보는 그의 극적인 인생 편력만큼이나 모험적·급진적이다. 문학 이외에도 예술의 경계를 활발히 넘나들며 활동해온 뒤라스는 연극, 영화 그 어떤 장르이건 전통이나 상식, 관습으로부터 자유로웠다.",1,국내도서-소설/시/희곡
309,9788954697637,124314300,지도와 영토,"16,200원",900원,미셸 우엘벡 저/장소미 역,문학동네,"프랑스문학의 거대한 태풍의 눈 미셸 우엘벡
그가 창조해낸 현대 문화예술계의 지형도이자
21세기에 대한 적확한 비평

* 2010 공쿠르상 수상작

현존하는 프랑스 작가 가운데 전 세계적으로 가장 많이 읽히는 작가 중 한 명이자 우리 시대 최고의 논쟁적인 작가 미셸 우엘벡의 『지도와 영토』가 문학동네 세계문학전집으로 새롭게 선보인다. 2010년 공쿠르상 수상작인 이 작품은 ‘지금 여기’를 살아가는 한 예술가의 통렬한 일대기로, 작가가 예언가적 시선으로 그려낸 현대 문화예술계의 정교한 지형도이자 21세기에 대한 적확한 비평으로도 읽힌다. 우엘벡은 그동안 천착해온 서구 자본주의 비판을 한층 세련된 방식으로 풀어내면서, 절정에 이른 블랙유머와 현기증나는 지적 언어를 통해 예술, 돈, 사랑, 아버지와의 관계, 죽음, 성공에 대한 깊이 있는 담론을 이끌어낸다.",2,국내도서-소설/시/희곡
310,9788937485725,115026775,잃어버린 시간을 찾아서 12,"13,500원",750원,마르셀 프루스트 저/김희영 역,민음사,"14년간(1909~1922) ‘잃시찾’을 써 나간 마르셀 프루스트,
10년간(2013~2022) ‘잃시찾’을 번역해 온 불문학자 김희영의 결실. 
『잃어버린 시간을 찾아서』 마지막 7편 「되찾은 시간」으로 드디어 완간!

마르셀 프루스트 서거 100주년이 되는 올해, 『잃어버린 시간을 찾아서』 마지막 7편 「되찾은 시간」(민음사판 12, 13권)이 민음사에서 출간됨으로써 총 13권이 완간되었다. 1편 「스완네 집 쪽으로」, 2편 「꽃핀 소녀들의 그늘에서」, 3편 「게르망트 쪽」, 4편 「소돔과 고모라」, 5편 「갇힌 여인」, 6편 「사라진 알베르틴」에 이어 10년 만의 결실이다. 『잃어버린 시간을 찾아서』는 총 7편에 이르는 연작 소설로서, 그 분량을 합하면 수천 쪽에 이르는 방대한 작품이다. 2013년 첫 책인 1편 「스완네 집 쪽으로」를 『잃어버린 시간을 찾아서』 출간 100주년을 맞아 펴낸 이래, 민음사에서는 7편 「되찾은 시간」을 끝으로 2022년에 완역을 성취했다.",1,국내도서-소설/시/희곡
311,9788932404790,74224010,작품,"16,200원",900원,에밀 졸라 저/권유현 역,을유문화사,인상파 미술이 대두되던 19세기 말 파리 예술가들의 삶과 현실을 매우 사실적이고 흥미롭게 그린 에밀 졸라의 소설 『작품』이 을유세계문학전집 97번째 작품으로 출간되었다. 루공과 마카르 가계의 역사를 토대로 프랑스 사회를 묘사한 ‘루공 마카르 총서’의 20권 중 열네 번째 책으로 발간된 『작품』은 당시 예술가들과 예술 작품에 대한 작가의 세부적인 관찰과 풍부한 표현이 돋보이는 소설이다. 졸라는 이 소설로 예술가들이 겪는 창작의 고뇌와 불안한 삶을 클로드 랑티에라는 작중 화가의 피하지 못한 숙명과 비참한 말로를 통해 생생하게 담아냈다.,1,국내도서-소설/시/희곡
312,9791186274255,39320762,비곗덩어리,"5,310원",290원,모파상 저/최내경 역,책읽는고양이,"루캣유어셀프

책읽는고양이에서 펴낸 단편소설시리즈이다. ‘단편소설에서 나다운 삶을 찾는다’는 컨셉으로 기획되었다. 기존의 단편집들이 10편 내외를 묶어 볼륨감 있게 구성된 것에 비하여 ‘루캣유어셀프’는 1~3편만을 묶어 편집하여, 한 편마다 담은 주제에 집중할 수 있는 여백을 중시하였다. 또 휴대하기 쉬운 크기와 두께로 언제 어디서나 친숙하게 단편을 즐길 수 있도록 차별화하였다. ‘루캣유어셀프’는 짧지만 하나의 주제에 집중하여 전해지는 이야기 속에서 나의 모습, 또 너의 모습과 만난다. 완역으로 다시 읽는 단편! 작가마다 달리 표출되는 인간 군상에 대한 묘사와 어김없이 찾아오는 반전의 묘미에 빠져든다. 어느 날 문득, 잠자고 있는 내면의 나를 깨우고 싶을 때 “Look at Yourself.”

《비곗덩어리》는 모파상의 데뷔작으로, 인간의 추악한 이기주의와 파렴치의 극치를 보여주는 걸작이다.",1,국내도서-소설/시/희곡
313,9788952779816,58281120,여인들의 행복 백화점 (리커버 합본 특별판),"19,800원","1,100원",에밀 졸라 저/박명숙 역,시공사,"세계 최초의 백화점 ‘봉 마르셰’를 모델로, 백화점의 발전상에 따른 사회적 명암과 
이를 둘러싼 다양한 인간 군상들의 모습을 완벽하게 그려낸 소설

『여인들의 행복백화점』은 에밀 졸라가 처음으로 ‘사회의 진보’라는 문제에 관해 적극적인 관심을 드러내며, 자본주의를 소설의 강력한 장치로 활용한 작품이다. 이 소설에서는 백화점이 배경의 역할에 머무르는 것을 뛰어넘어 이야기를 이끌어가는 실질적인 주인공으로 기능한다. 에밀 졸라는 이미 이 작품을 통해 현대 백화점의 전략들과 자본주의의 매커니즘을 상세히 묘사했다. 

실제로 이 작품에는 정가제, 세일, 미끼 상품, 반품, 통신판매, 직원 성과급, 음료 서비스, 광고, 포스터, 백색 대전시회, 아동 마케팅, 경품 증정 등 현재의 백화점이 사용하는 대부분의 전략이 포함되어 있다.",1,국내도서-소설/시/희곡
314,9788937485664,23416954,잃어버린 시간을 찾아서 6,"15,300원",850원,마르셀 프루스트 저/김희영 역,민음사,"국내 최고의 프루스트 번역서, 후속편 출간   
『잃어버린 시간을 찾아서』, 그 세 번째 이야기, 「게르망트 쪽」
청년기에서 성년기로, 감성에서 지성으로

1편 「스완네 집 쪽으로」, 2편 「꽃핀 소녀들의 그늘에서」에 이어 3편 「게르망트 쪽」이 『잃어버린 시간을 찾아서』 5, 6권으로 출간되었다. 이번 편에서는 유년기를 보낸 콩브레, 첫사랑과 문학적 스승을 만난 발베크를 떠나, 오랫동안 몽상과 선망의 대상이었던 게르망트 저택의 별채로 이사한 마르셀의 이야기가 펼쳐진다. 
 
아침마다 거리에서 마주치는 게르망트 부인을 동경하게 된 마르셀은 그녀에게 보다 가까이 다가가기 위해 그녀의 조카이자 자신의 친구인 생루를 찾아 군사 도시 동시에르로 가고, 빌파리지 부인을 비롯하여 그토록 열망하던 게르망트 공작 부인의 만찬에 참석해 포부르생제르맹 귀족 사회와 맞닥뜨린다.

포부르생제르맹 귀족 사회를 대표하는 ‘이름’이자 마르셀의 유년기 머리맡을 장식하던 환등기 속에서, 그리고 마지막 편 「되찾은 시간」의 가면무도회에 이르기까지 화자의 긴 여정을 동반하는 마술적인 ‘이름’인 ‘게르망트’는 『잃어버린 시간을 찾아서』 전체를 관통하는 열쇠와도 같다. 프루스트는 「게르망트 쪽」에 대해 “청년기에서 성년기로, 감성에서 지성으로 넘어가는 ‘중간 단계’”라고 밝힌바, 배움의 과정에서 필수적인 환상과 환멸, 꿈과 깨어남을 다룬다는 점에서 반드시 거쳐야 할 이야기라고 할 수 있을 것이다.

",1,국내도서-소설/시/희곡
