순위,ISBN,상품번호,상품명,판매가,YES포인트,저자,출판사,설명,출고예상일,관리분류
1,9788937443848,4827613,이방인,"9,000원",500원,알베르 카뮈 저/김화영 역,민음사,"20세기의 지성이자 실존주의 문학의 대표 작가 알베르 카뮈. 
현실에서 소외되어 이방인으로 살아가는 현대인의 초상을 그리다.

낯선 인물과 독창적인 형식으로 현대 프랑스 문단에 '이방인'처럼 나타난 소설. 젊은 무명 작가였던 알베르 카뮈에게 세계적 명성을 안겨준 이 작품은 현실에서 소외되어 이방인으로 살아가는 현대인이 죽음을 앞두고 비로소 마주하는 실존의 체험을 강렬하게 그린다.",1,국내도서-소설/시/희곡
2,9788937461798,2950700,브람스를 좋아하세요...,"9,000원",500원,프랑수아즈 사강 저/김남주 역,민음사,"프랑스 문단의 섬세한 심리 묘사의 대가 프랑수아즈 사강이 그려낸 세 남녀의 사랑과 집착, 일탈, 불안, 기쁨. 이 작품은 전혀 다른 두 사랑 앞에서 방황하는 폴의 심리를 중심으로, 사랑이라는 감정으로 그녀와 연결된 로제와 시몽의 심리를 섬세하게 묘사하고 있다.",1,국내도서-소설/시/희곡
3,9791164455300,103952369,초판본 어린왕자,"2,700원",140원,생텍쥐페리 저/김미정 역,더스토리,"전 세계인이 가장 사랑하는 스테디셀러!
250여 개 언어로 번역, 1억 부 이상 판매된 명작!
세상에서 가장 순수한 영혼, 『어린 왕자』 오리지널 초판본 표지디자인!

생텍쥐페리는 프랑스의 유명한 소설가로, 그의 작품 『어린 왕자』는 전 세계적으로 『성경』, 『자본론』 다음으로 많이 읽히는 책이다. 250여 개 언어로 번역되었고 1억 부 이상이 팔렸다. 그런데 아이러니하게도 『어린 왕자』는 프랑스가 아니라 미국 뉴욕에서 처음 출판되었다. 당시 생텍쥐페리는 제2차 세계대전으로 미국에서 망명 중이었고, 『어린 왕자』는 1943년 4월 6일에 영어판과 프랑스어판으로 뉴욕에서 동시 출간되었다.

더스토리에서 출간한 무선 초판본 표지디자인 『어린 왕자』는 1943년 뉴욕에서 출판된 프랑스어판 초판본 표지디자인을 그대로 되살렸다. 어둡지도 너무 빛바래지도 않은 노란색 표지와 어린 왕자의 연둣빛 옷의 색감이 잘 살아 있으며, 본문에는 생텍쥐페리의 친필 사인이 들어 있다. 
",1,국내도서-소설/시/희곡
4,9791190669313,93082287,어린 왕자 오리지널 초판본,"2,880원",160원,앙투안 드 생텍쥐페리 저/김수영 역,코너스톤(도서),"‘가장 중요한 것은 눈에 보이지 않아.’
모두가 사랑하는 『어린 왕자』를 초판본 디자인으로 만나보세요.

“네가 만약 오후 네 시에 온다면, 나는 세 시부터 행복할 거야. 그리고 시간이 갈수록 더 행복해지겠지. 네 시가 되면 흥분으로 안절부절못할 거야. 그래서 행복이 얼마나 값진 것인지 알게 되겠지! 하지만 네가 아무 때나 오면, 난 언제 마음의 준비를 해야 할지 모를 거야…. 그래서 의식이 필요한 거야.”

사막에 추락한 조종사가 지구를 여행 중인 어린 왕자를 만나는 생텍쥐페리의 대표작, 『어린 왕자』는 1943년 출간 이래로 지금까지 연극, 영화, 뮤지컬, 만화, 애니메이션, 오페라, 샹송, 카세트테이프, CD 등 다양한 매체로 변용되어 많은 사랑을 받고 있다. 독자들이 읽을 때마다 늘 새로운 의미를 발견하게 해주는 『어린 왕자』는 디지털 시대에 아날로그적인 종이 책만 1억 5천만 부 이상이 팔린 것으로 유명하다.",1,국내도서-소설/시/희곡
5,9788986836837,115275383,왜 나는 너를 사랑하는가,"12,600원",700원,알랭 드 보통 저/정영목 역,청미래,"보통의 연인들을 위한 보통의 연애담
국내 70만 독자가 선택한 알랭 드 보통의 최고의 소설

연애가 사랑이 되는 순간, 우연이 사랑이 되는 순간의 비밀
사랑은 무엇이고 연애란 또 무엇인가? 
이 영원한 질문에 관한 가장 진실한 해답

30개국에서 베스트셀러를 기록한 알랭 드 보통의 대표작 『왜 나는 너를 사랑하는가』가 70만 부 판매를 기념하여 산뜻한 표지로 새롭게 출간되었다. 런던과 파리를 오가는 비행기에서 우연히 만나 순식간에 사랑에 빠진 두 젊은이에 관한 이 소설은 연인이라는 특별한 관계와 사랑의 감정을 놀라운 깊이로 그려내며 출간 직후 전 세계의 독자들을 사로잡았다.

“사랑에 빠지는 행위는 자기 자신의 허점을 넘어서고 싶어하는 인간 희망의 승리이다.” 알랭 드 보통의 이 흥미로운 소설은 사랑에 관한 철학적 명상으로 가득 차 있다.",1,국내도서-소설/시/희곡
6,9788982816635,359901,자기 앞의 생,"14,400원",800원,에밀 아자르 저/용경식 역,문학동네,"유일하게 공쿠르 상을 두 번 받은 작가 로맹 가리
하밀 할아버지, 사람은 사랑 없이도 살 수 있나요?

‘휴머니즘의 작가’로 알려진 로맹 가리는 러시아 이민자 출신의 유태인이다. 2차세계대전 후 그는 세계 각지에서 외교관으로 일하면서 1956년에는 소설 『하늘의 뿌리』로 공쿠르 상을 수상했다. 그는 가명으로도 여러 소설을 발표했는데, 아자르의 이름으로 발표한 두번째 소설 『자기 앞의 생』으로 한 작가에게 결코 두 번 주어지지 않는다는 공쿠르 상을 수상하게 되면서 공쿠르 상을 두 번 받은 작가가 되었다. 

작가는 자기의 실제 나이보다 많은 나이를 살고 있는 열네 살 모모의 눈을 통해 이해하지 못할 세상을 바라본다. 모모의 눈에 비친 세상은 결코 꿈같이 아름다운 세상이 아니다. 아이의 눈으로 바라보기 때문에 세상은 더욱 각박하고 모진 곳이다. 아랍인, 아프리카인, 창녀들, 노인... 모모가 사랑하는 사람들은 모두 사회로부터 소외되어 밑바닥 인생을 살아가는 사람들이다.",1,국내도서-소설/시/희곡
7,9788932917245,22431294,어린 왕자,"10,620원",590원,앙투안 드 생텍쥐페리 저/황현산 역,열린책들,"고 황현산 선생의 미려하고 충실한 번역과 함께
한겨울의 풍경을 그린 특별한 한정판 디자인으로 만나는 어린 왕자

프랑스 문학 연구자이자 문학 평론가인 고 황현산 선생의 미려한 번역으로 열린책들에서 출간된 생텍쥐페리의 『어린 왕자』가 특별한 한정판 디자인으로 다시 선보인다. 다양한 번역본 중에서도 단연 아름답고 충실한 문장으로 손꼽히는 황현산 선생의 번역은 지금껏 가장 많이 팔리는 한국어판으로 자리 잡고 있다.

이번에 출간하는 한정판은 우리의 마음에 언제나 남아 있는 어린 왕자가 맞이한 한겨울의 크리스마스 모습을 담은 디자인이다. 눈사람과 산타클로스 모자, 반짝이는 장식과 한 아름의 선물이 어린 왕자를 따스하게 둘러싼 사랑스러운 풍경을 특별하게 간직해 볼 수 있다.

「밤하늘을 바라볼 때면, 그 별들 중의 어느 별에서 살고 있을 테니까」라고 속삭인 어린 왕자의 말처럼, 이번 겨울 에디션은 먼 별에서 보내고 있을 어린 왕자의 다정한 시간을 행복하게 상상하도록 한다.",1,국내도서-소설/시/희곡
8,9791194280781,142685990,초판본 이방인,"2,690원",140원,알베르 카뮈 저/최헵시바 역,더스토리,"실존주의 문학의 선구자, 노벨 문학상 수상작가 
알베르 카뮈의 대표작 《이방인》
[르 몽드] 선정 20세기 최고의 작품 1위!
생의 부조리와 인간의 실존을 다룬 작품억압적 관습과 현실의 부조리의 민낯을 보여 준
실존주의 문학의 대표 작품 《이방인》

《이방인》은 알베르 카뮈가 구상한 부조리극의 삼부작 중 하나이자 그가 쓴 최초의 소설이다. 1942년 5월 말, 출간 당시부터 문학적 ‘사건’으로 취급될 정도로 엄청난 호평을 받았으며 제2차 세계대전 이후 최대의 걸작이라는 극찬을 받았다. 《이방인》은 작품 그 자체로 보나 20세기 서사 형식의 역사에서 보나 독보적인 위치에 있는 작품이다. 당시 스물아홉의 젊은 알베르 카뮈를 세계적 작가의 반열에 올려놓고, 1957년 노벨 문학상의 영예를 안겨주기도 했다. 

20세기를 마감하던 1999년 프랑스의 권위지 〈르 몽드〉가 지난 세기 최고의 작품을 선정하는 투표를 실시했다.",1,국내도서-소설/시/희곡
9,9788937462672,4827619,페스트,"12,600원",700원,알베르 카뮈 저/김화영 역,민음사,"위험이 도사리는 폐쇄된 도시, 
극한의 절망과 마주하는 다양한 인간 군상.

페스트라는 비극의 소용돌이 속에서도 현실을 직시하며 의연히 운명과 대결하는 인간의 모습을 다룬 걸작. 카뮈는 이 작품에서 공포와 죽음, 이별의 아픔 등 인간이 경험하게 되는 극한의 고통과 절망을 그려낸다.",1,국내도서-소설/시/희곡
10,9788932924984,143753016,그녀를 지키다,"19,800원","1,100원",장바티스트 앙드레아 저/정혜용 역,열린책들,"★★★ 2023년 공쿠르상 수상
★★★ 2023년 프낙 소설상 수상

데뷔 이래 단 네 권의 소설로 프랑스 주요 문학상 19개를 수상한
지금 가장 뜨겁게 주목받는 작가, 장바티스트 앙드레아의 빛나는 걸작

펴내는 소설마다 프랑스의 주요 문학상을 휩쓸며 폭발적인 화제를 모으고 있는 장바티스트 앙드레아의 장편소설 『그녀를 지키다』가 정혜용 씨의 번역으로 열린책들에서 출간되었다. 세계 3대 문학상인 공쿠르상을 수상한 이 작품은 수도원 지하에 유폐된 피에타 석상에 숨겨진 비밀을 석공 미모의 굴곡진 삶을 통해 풀어 가면서, 파시즘이 득세하던 당시 이탈리아의 풍경을 섬세하게 묘사하고 그 속에서 태생적 한계와 사회적 난관에도 꺾이지 않는 인간 영혼의 아름다움을 설득력 있게 보여 준다.

영화감독이자 시나리오 작가이기도 한 장바티스트 앙드레아는 자신의 특기를 유감없이 발휘해 소설의 장면 장면을 마치 영화의 한 컷처럼 생동감 넘치게 담아 냈다.",1,국내도서-소설/시/희곡
11,9791159319013,123773528,행복한 죽음,"9,720원",540원,알베르 까뮈 저/김화영 역,책세상,"알베르 카뮈 탄생 110주년인 2023년을 맞아 새로운 장정과 번역으로 선보이는 ‘책세상 카뮈 전집 개정판’ 5권. 카뮈가 1936년에서 1938년 사이에 구상 및 집필했으나, 카뮈 사후 1971년에야 세상에 빛을 보게 된 카뮈의 실질적인 데뷔작이자 『이방인』의 모태가 된 소설. 『결혼·여름』과 같은 초기 산문에서 볼 수 있는 청년 카뮈의 에피소드 등이 활용돼 있어, 카뮈의 애독자에게 귀중한 선물이 될 작품이다.
",2,국내도서-소설/시/희곡
12,9788956608846,30547371,낭만적 연애와 그 후의 일상,"15,300원",850원,알랭 드 보통 저/김한영 역,은행나무,"알랭 드 보통, 21년 만의 장편 소설



“언제 다시 소설을 쓸 거냐고 물으면 전 항상

‘사랑에 대해 쓸 것이 충분히 생기면’이라고 대답했습니다.”



사랑이 이루어지고 나면 연인들에게는 무슨 일이 벌어질까? 알랭 드 보통이 21년 만에 내놓은 이 소설은 결혼한 한 커플의 삶을 통해 일상의 범주에 들어온 사랑에 대해 통찰한다. 열렬히 사랑을 고백하고 영원을 약속한 연인도 어느 순간 상대의 유일무이함에 의구심을 품게 되기 마련이다. 그렇다면 그것은 애초에 사랑이 아니라는 낭만주의적 결론이나 사랑 자체가 존재하지 않는다는 비관론적 결론에 지체하지 않고 알랭 드 보통은 지금의 사랑을 어떻게 하면 지속가능하게 할 것인지에 대해 현실적인 논의를 펼친다.",1,국내도서-소설/시/희곡
13,9791194591627,143793084,초판본 페스트,"3,590원",190원,알베르 카뮈 저/변광배 역,더스토리,"질병에 맞서는 인간의 원초적 본능!

노벨 문학상 수상 작가 알베르 카뮈가
바이러스와 싸우는 2020년의 인간들에게 던진 해법

“죽음 앞에서 인류의 직무 태만을 꼬집는 걸작”_ [가디언]

노벨문학상 수상작가 알베르 카뮈의 대표작
사회 부조리에 대한 묘사와 인간 심리를 사실적으로 묘사한 걸작

《페스트》는 《이방인》 《시지프 신화》 등으로 널리 알려진, 노벨 문학상 수상작가 알베르 카뮈의 대표작이다. 《페스트》는 ‘페스트’의 창궐로 위기에 빠진 오랑시의 시민들이 보여주는 다양한 삶의 방식에 대한 연대기다. 이 작품에서 문학적으로 형상화한 ‘페스트’는 분명 질병이다. 하지만 이 작품을 집필한 배경을 고려하면 ‘페스트’는 질병과 동시에 전쟁, 나치즘 등을 상징한다. 리외가 지적하는 것처럼 ‘페스트’는 언제라도 돌아올 수 있는 것이라면, ‘페스트’가 갖는 상징적 의미는 이와 같은 병리적, 사회·역사적 의미다.",1,국내도서-소설/시/희곡
14,9788937461446,2546383,연인,"8,100원",450원,마르그리트 뒤라스 저/김인환 역,민음사,"프랑스 현대 문학의 대표적 여성 작가 마르그리트 뒤라스의 공쿠르 상 수상작이자, 뒤라스 자신이 겪은, 베트남에서의 가난한 어린 시절과 중국인 남자와의 광기 서린 사랑을 섬세하고 생생한 묘사로 되살려 낸 자전적 소설이다. 가난한 환경에 대한 절망으로 무기력해진 어머니, 어머니의 편애를 받으며 마약과 노름에만 빠져 있는 난폭한 큰 오빠 그리고 늘 큰 오빠에게 시달리는 나약한 작은 오빠. 이 비정상적인 가족에 대한 혐오가 더해 갈수록 소녀('나')는 중국인 남자와의 관계에 더욱 몰입하고, 그 관계는 점점 광적인 욕망과 공...",1,국내도서-소설/시/희곡
15,9788954603096,2543067,어린 왕자,"10,800원",600원,앙투안 마리 로제 드 생텍쥐페리 저/김화영 역,문학동네,"비밀을 가르쳐줄게. 아주 간단한 거야. 
오직 마음으로 보아야 잘 보인다는 거야. 
가장 중요한 건 눈에 보이지 않아.

이 간단한 비밀을 잊고 산 지 얼마나 오래된 걸까. 
세상에서 가장 아름답고 슬픈 풍경 위로 쓰러진 ‘그’를 잊고 지낸 지는? 
어린 시절에 만났던 ‘그’의 이야기는 어쩌면 그저 슬프고 아름다운 동화였을지도 모른다. 그 먹먹하고 아련한 슬픔의 정체가 정확하게 무엇인지도 모르고 그저 슬프기만 했던……

김화영 선생이 번역한 '어린왕자'는 원본에 가장 가까운 형태로 출간된 1999년판 폴리오 판을 그...",1,국내도서-소설/시/희곡
16,9788974431143,58959070,나무를 심은 사람,"9,000원",500원,장 지오노 저/최수연 그림/김경온 역,두레,"전 세계 25개 언어로 번역된 세계적인 베스트셀러
문명과 환경의 심각한 위기 속에서 우리가 나아가야 할 방향을 가르쳐주고,
사람과 세상을 변화시키는 감동적이고 가슴 따듯한 소설!
국내 대표적인 삽화가 최수연의 아름다운 컬러 삽화로 다시 펴낸 개정판

문학적 향기와 메시지가 어우러진, 한 편의 탁월한 우화!

이 소설은 ‘희망을 심고 행복을 가꾼’ 한 사람이 메마르고 황폐한 땅에 홀로 수십 년 동안 나무를 심어 황무지를 생명이 살아 숨쉬는 숲으로 바꾸어놓는 이야기로, 작가가 자신의 경험을 바탕으로 첫 원고를 쓴 뒤 20여 년 동안 다듬어 완성한 작품이다. 1953년 처음 발표된 이래 지금까지 25개 언어로 번역되어 세계적으로 널리 읽히고 있다. 이토록 짧은 작품이 우리에게 깊은 감동과 울림을 주는 이유는 깊은 문학적 향기와 더불어 강력한 메시지를 전하기 때문이다.",1,국내도서-소설/시/희곡
17,9791194591399,143302645,초판본 야간 비행,"2,690원",140원,앙투안 드 생텍쥐페리 저/윤정임 역,더스토리,"1931년 페미나 문학상 수상,
어린 왕자의 작가 생텍쥐페리의 두 번째 대표작 《야간 비행》
노벨 문학상 수상작가 앙드레 지드의 서문 수록

진정한 모험가 생텍쥐페리가 써 낸 21세기의 새로운 영웅 서사시!
한계와 역경, 비극에 맞서 싸우는 인간의 고귀함 

1931년에 출간된 생텍쥐페리의 두 번째 소설 《야간 비행》은 발표 즉시 독자와 평단의 호평을 받으며 그해 페미나(Femina) 상을 수상했다. 특히 이 작품은 대문호 앙드레 지드의 찬탄으로 더욱 빛을 발했으며 곧 전 세계에 번역되어 1933년에는 영화로도 제작되었다.

생텍쥐페리는 1920년 공군에 입대해 조종사 훈련을 받고 1926년에 프랑스 항공사에 입사한다. 1929년에 아르헨티나 야간 항로 개발에 참여하게 된 그는 당시의 경험을 통대로 이 작품을 탄생시켰다.",1,국내도서-소설/시/희곡
18,9791189356934,117862086,자살,"14,400원",800원,에두아르 르베 저/한국화 역,워크룸프레스,"프랑스 작가 에두아르 르베의 『자살』(한국화 옮김)이 워크룸 문학 총서 ‘제안들’ 31권으로 출간되었다. 사진과 글을 주요 매체로 삼아 활동한 에두아르 르베는 개념적인 작업에 몰두한 작가였다. 자신에게 영향을 준 예술가들과 이름이 같은 이들을 전화번호부에서 찾아 찍고, 유럽의 도시와 이름이 같은 미국의 도시를 촬영하고, 전형적인 인물들의 포즈나 회화, 꿈속 장면 등을 현실의 사진으로 재구성했던 그는 2002년 533개 작품 아이디어를 모은 『작품들』을 출간하면서 문학가로서의 이력을 시작했다. 이 책 『자살』은 에두아르 르베가 자살한 이듬해에 출간된 책으로, 그가 자살하기 며칠 전 송고한 글이다.",1,국내도서-소설/시/희곡
19,9791197153327,97928114,나만의 필사책 어린 왕자,"16,920원",940원,앙투안 드 생텍쥐페리 저/박선주 역,마음시선,"나만의 손글씨와 그림으로 
세상에서 단 하나뿐인 ‘어린 왕자’를 만나다

마음을 다해 쓰는 글씨 [나만의 필사책] 시리즈를 여는 첫 책. [나만의 필사책] 시리즈는 나에게, 친구에게, 자녀에게, 내 곁의 소중한 사람들에게 선물하고 싶은 책을 만들고 싶다는 생각에서 출발했다. ‘책은 어렵다’, ‘취향을 탄다’는 편견을 깨트리고, 좀 더 많은 이들이 책을 편하고 쉽게 접하길 바라는 마음으로 우리에게 친숙한 『어린 왕자』로 필사책을 만들었다. 

독서를 처음 시작하는 아이들도 편안하게 느낄 수 있도록 책 전체에 따뜻한 색감을 사용했으며, 글씨를 썼을 때 뒷장에 비침이 적도록 두꺼운 본문 종이를 사용했다. 아름다운 삽화를 따라 그릴 수 있도록 그림이 들어간 곳에는 칸을 크게 비워두었고, 하루에 한 페이지씩 부담 없이 따라 쓸 수 있도록 각 페이지가 끝나는 곳을 맺음말로 편집했다.",1,국내도서-소설/시/희곡
20,9788984374942,140075936,미로 속 아이,"16,650원",920원,기욤 뮈소 저/양영란 역,밝은세상,"기욤 뮈소 데뷔 20주년 기념작 『미로 속 아이』 출간



- 범인은 예측 불가의 영역에 있다. 

- 서스펜스 마스터 기욤 뮈소의 2024년 신작!

- 프랑스 베스트셀러 1위!



기욤 뮈소가 작가로 데뷔한 지 20년이 되었다. 『미로 속 아이』는 기욤 뮈소 데뷔 20주년 기념작으로 작가의 고향 앙티브에서는 새로운 소설 출간과 더불어 그가 쌓아온 업적을 기리는 행사가 열렸다. 기욤 뮈소의 데뷔 20주년 기념작 출간에 발맞춰 앙티브에 그의 이름을 딴 학교가 문을 열었고, 프랑스 언론들은 대대적인 인터뷰 릴레이를 벌이며 그가 20년 동안 남긴 발자취를 조명했다.



매년 『르 피가로』와 〈프랑스서점연합회〉에서 조사하는 베스트셀러 작가 순위에서 8년 연속 1위를 기록했을 만큼 기욤 뮈소의 소설은 지난 20년 동안 프랑스에서 어느 누구도 이루지 못한 성과를 남겼다.",1,국내도서-소설/시/희곡
21,9788937454769,124260842,내 식탁 위의 개,"16,200원",900원,클로디 윈징게르 저/김미정 역,민음사,"2022년 페미나상 수상작

“눈가에 눈물이 맺힌 채로도 나는 끄떡없이 글을 쓴다.”

숲속 늙은 부부 앞에 나타난 학대당한 개 한 마리
그 개가 가르쳐 준 광대한 세계와 그 세계를 사랑하는 법에 관하여 

세상과 멀리 떨어진 숲속에서 단둘이 살아가는 늙은 부부 앞에 어느 날 학대당한 개 한 마리가 나타난 후 두 사람의 일상과 마음에 일어나는 변화를 감동적으로 그린 2022년 페미나상 수상작 『내 식탁 위의 개』가 민음사에서 출간되었다. 저자인 클로디 윈징게르는 올해 여든세 살의 작가이자 조형 예술가로 한국에는 처음 소개된다. 70세라는 늦은 나이에 소설가로 데뷔했으나 그는 이미 1970년대부터 알자스 지방 보주산맥에 있는 방부아 숲에서의 삶을 이야기한 책들을 발표하고 또 이와 관련한 일련의 조형 예술 활동을 활발히 해 온, 프랑스에서는 유명한 예술가이다.",1,국내도서-소설/시/희곡
22,9788937464652,144490579,안과 겉·결혼·여름,"13,500원",750원,알베르 카뮈 저/김화영 역,민음사,"마흔네 살이란 젊은 나이에 신화가 된, 실존주의 문학을 대표하는 작가 알베르 카뮈. 
모든 작품의 원천 「안과 겉」, 자연과 인간의 합일 「결혼」, 지중해의 추억 「여름」 수록

“삶에 대한 절망 없이는 삶에 대한 사랑은 없다.”

* 카뮈는 신화가 되었다. 그를 인정하느냐 안 하느냐는 이제 별 의미가 없다. -롤랑 바르트
* 카뮈는 살아 있을 때 그렇게도 벗어나고자 했던 바로 그 주춧돌 위에 지금 올라와 있다. -파트리크 모디아노
* 카뮈의 위대함은 일탈에서 나오는데, 이 일탈은 그의 위대함의 자연스러운 표현일 뿐이다. -장 그르니에
* 끊임없이 자신을 찾고 자신에게 질문을 던지는 영혼에게 인사를 드린다.",1,국내도서-소설/시/희곡
23,9788937486104,7957394,레 미제라블 세트,"47,700원","2,650원",빅토르 위고 저/정기수 역,민음사,,1,국내도서-소설/시/희곡
24,9791196554866,105751260,패배의 신호,"19,800원","1,100원",프랑수아즈 사강 저/장소미 역,녹색광선,"『패배의 신호』(La Chamade)는 1965년 막 서른 살이 된 프랑수아즈 사강이 『신기한 구름』(1961) 이후 4년 만에 출간했던 여섯 번째 소설이다. 두 번의 결혼과 두 번의 이혼, 그 사이의 수많은 연애를 거치고 난 다음이었고, 한 아이의 어머니가 된 이후였다. 그녀는 “모르는 것은 쓸 수가 없다. 느끼지 못하는 것도 쓸 수가 없다. 체험하지 않은 일은 쓸 수가 없다""고도 말했다. 그렇다면 『슬픔이여 안녕』을 내놓은 이후 11년이 지나 삼십 대로 접어든 시점에서 사강의 작품 세계는 어떻게 달라져 있었을까?

사강은 앞선 작품들과 마찬가지로 여전히 사랑과 이별이라는 주제를 다루고 있지만, 이 작품 『패배의 신호』에서는 보다 깊어진 관능성을 보여 준다. 전작들보다 훨씬 구체적인 사랑과 욕망의 장면들이 촘촘하게 표현됨과 동시에 인간이 타인에게 매혹되었을 때 발현되는 심리의 묘사가 작품을 가득 채운다.",1,국내도서-소설/시/희곡
