순위,ISBN,상품번호,상품명,판매가,YES포인트,저자,출판사,설명,출고예상일,관리분류
434,9788932040875,115456888,아돌프의 사랑,"9,900원",550원,뱅자맹 콩스탕 저/김석희 역,문학과지성사,"“사랑은 나에게 인생의 전부였지만, 
당신 인생의 전부가 될 수는 없는 일이지요.”

자기 파멸로 치닫는 사랑의 심리를 치밀하게 분석해낸
프랑스 근대 심리소설의 선구적 대표작

프랑스 근대 심리소설의 선구적 대표작으로 평가받는 뱅자맹 콩스탕의 『아돌프의 사랑』(김석희 옮김)이 ‘문지 스펙트럼’ 시리즈로 새롭게 리뉴얼되어 출간되었다. 심리소설의 걸작으로 일컬어지는 스탕달의 『적과 흑』(1830)보다 10여 년 앞서 1816년에 발표된 이 작품은, 사랑에 빠진 두 사람이 인습과 욕망을 사이에 두고 겪는 내적 갈등을 치밀하게 묘사하고 있다는 점에서 요한 볼프강 폰 괴테의 『젊은 베르테르의 슬픔』에 비견되기도 한다. 특히 국내 최고의 번역가 김석희가 번역을 도맡아 한 이 작품은 번역가 자신에게도 특별한 의미를 갖는다. 1979년 출간된 그의 첫 번역서로서, 『아돌프의 사랑』은 “내 인생의 이정표를 정한 최초의 순간”이었던 것이다.",1,국내도서-소설/시/희곡
435,9788968332463,89342518,오페라의 유령,"12,420원",690원,가스통 르루 저/신소영 역,허밍버드,"음악 예술로 꽃핀 고전 문학
X 드롭드롭드롭의 감각적 디자인,
『허밍버드 클래식 M』

음악과 함께 무대 위에서 펼쳐지는 다양한 예술. 그중에서도 오늘날 우리가 특히 사랑하는 뮤지컬과 오페라의 상당수가 고전 문학을 원작으로 한다. 이에 그러한 고전들을 엄선하여 『허밍버드 클래식 M』으로 선보인다. 텍스트의 품격을 충실히 살리되 라이프스타일 브랜드인 드롭드롭드롭(drpdrpdrp)과 컬래버레이션하여 트렌디한 디자인으로 구현했다. 그 세 번째 작품은 『오페라의 유령』. 기괴하고 수수께끼 같은 사건과 순수하고 애절한 사랑이 뒤얽히며 비극적인 결말을 향해 폭주하는 이 소설은, 로맨틱 미스터리 걸작으로 전 세계 대중에게 깊은 감동과 여운을 안겨 주고 있다.",2,국내도서-소설/시/희곡
436,9788937463273,15153891,반바지 당나귀,"11,700원",650원,앙리 보스코 저/정영란 역,민음사,"감미롭고 심오한 상상 세계를 통해 평생 영성을 모색한 작가, 
앙리 보스코의 대표작
경이와 신비 속에 소용돌이치는 세계, 지상 낙원을 꿈꾸는 인간 정신의 모험

불모의 땅에서 낙원을 가꾸는 노인 시프리앵. 그 정원의 매력에 이끌려 든 호기심 많은 소년과 소녀. 마을의 영적 아버지인 본당 신부, 그에게 낙원의 꽃을 전해 주는 당나귀. 오늘날에도 여전히 신의 축복을 기다리는 마을 뻬이루레를 배경으로 한 이 작품은 신비와 몽상을 넘나드는 경이로운 세계를 보여 준다. 인간과 동물, 식물, 영혼과 대지의 크고 작은 모든 것이 서로 어울려 진동하는 상상 세계를 통해 보스코는 우리가 정녕 원하고 기다리고 자연에 귀 기울인다면 우리가 살고 있는 바로 이 땅에서 진정한 낙원과 우정을 혹은 그 예표를 만날 수 있음을 시사한다.

‘가장 위대한 몽상가’, 보스코를 따라감으로써 우리는 그의 꿈들 속에 간직되어 있는 유년 시절 몽상의 깊이를 발견할 수 있다.",1,국내도서-소설/시/희곡
437,9788993785128,4046604,캉디드 혹은 낙관주의,"6,750원",370원,볼테르 저/김용석 역,부북스(BooBooks),"계몽주의 시대의 철학자 볼테르가 1759년에 쓴 프랑스 풍자소설이다. 웃음을 통해서 지성에 호소하는 철학적 콩트의 대표작으로써 가장 예술적 가치가 높게 평가되고 있다. 또한 당시의 모순된 사회와 정치, 부패한 성직자들, 그리고 대중의 어리석음, 특히 전쟁과 종교적 불관용에 대해 신랄하게 비판하여 화제가 되었된 18세기 프랑스 최고의 걸작으로 꼽힌다.",1,국내도서-소설/시/희곡
438,9788937480065,310497,삼총사 3,"10,800원",600원,알렉상드르 뒤마 저/이규현 역,민음사,"2002년 알렉상드르 뒤마 탄생 이백 주년을 기념해 출간된 한국 최초의 완역본으로, 첫 시도에 걸맞은 철저한 고증 작업을 거쳐 이백여 년 전 네 총사가 펼치는 모험담을 정확하고도 생생하게 그려 냈다. 영화 「삼총사 3D」개봉에 맞춰 새로운 표지를 선보이며 특별판으로 재출간됐다. 1844년 발표된 이후 영화, 만화, 뮤지컬 등으로 끊임없이 재탄생하며 변함없는 사랑을 받고 있는 『삼총사』는 알렉상드르 뒤마의 대표작으로 대중성과 문학성을 모두 갖춘 이 시대의 대표 고전이다. 

『삼총사』특별판은 영화 포스터를 표지로 사용?..",1,국내도서-소설/시/희곡
439,9788932461427,128183143,사랑 바다,"18,000원","1,000원",파스칼 키냐르 저/백선희 역,을유문화사,"『세상의 모든 아침』과 『음악 혐오』를 한데 모은 듯한,
파스칼 키냐르 소설 세계의 총화

17세기 예술가들의 기구한 삶을 통해 바라보는
이 덧없고도 아름다운 세계에 관한 소설

파스칼 키냐르가 쓴 시대극은 잠잠히 잦아든 영혼들로 채워져 있다. 그들은 불타 버린 들판에 새로 난 싹들 같다. 극적인 사건들이 몸과 마음을 다 태운 뒤에 그 자리에 새로 피어난 영혼들은 식물처럼 고요하고 그 풀을 먹고 사는 초식 동물처럼 예민하다. 이들은 사람들 사이에서 통용되는 언어보다 자연과 감각에서 오는 자극에 더 민감한 사람들이다. 이들이 키냐르 소설 세계의 주축을 이룬다.

특히 17세기 음악가들을 중심으로 펼쳐지는 이 작품 속에는 작가가 기존에 창조 혹은 재창조했던 인물들이 다시금 등장한다. 바로 『세상의 모든 아침』의 주인공 생트 콜롱브와 『로마의 테라스』의 주인공 조프루아 몸므다.",1,국내도서-소설/시/희곡
440,9788936439361,122885740,시티 픽션 : 파리,"4,500원",250원,"기 드 모파상,드니 디드로 저/이규현 역",창비,"이야기로 팽창하는 파리의 밤

파리 편에는 세계인이 사랑하는 단편 소설의 대가 기 드 모파상의 「밤: 악몽」과 18세기 프랑스를 가장 잘 대변한다고 할 수 있는 사상가 드니 디드로의 「이것은 소설이 아니다」를 실었다. 「밤: 악몽」은 모파상이 1885년부터 건강이 심히 나빠져 환각을 경험하며 써낸 단편 중 하나로 샹젤리제부터 불로뉴 숲까지, 파리 시내를 한밤에 끊임없이 헤매는 방황의 여정을 짧고 몰입감 있게 담아냈다. 「이것은 소설이 아니다」는 인물들이 나누는 대화를 통해 파리를 배경으로 하는 두가지 이야기를 전개한다.",2,국내도서-소설/시/희곡
441,9791164457311,119948137,초판본 페스트,"17,820원",990원,알베르 카뮈 저/변광배 역,더스토리,,1,국내도서-소설/시/희곡
442,9791160272888,108045500,길모퉁이 카페,"12,420원",690원,프랑수아즈 사강 저/권지현 역,소담출판사,"국내 정식 라이선스 계약
2022년 리커버 개정판으로 새롭게 선보이는 『길모퉁이 카페』
인생에서 마주칠 수 있는 열아홉 가지 이별!

소담출판사에서 국내 정식 라이선스 계약으로 출간돼 많은 사랑을 받았던 프랑수아즈 사강의 『길모퉁이 카페』를 2022년 리커버 개정판으로 새롭게 선보인다. 사강의 대표작 『마음의 파수꾼』, 『마음의 푸른 상흔』, 『어떤 미소』, 『한 달 후, 일 년 후』와 함께 리커버된 개정판 도서로, 파스텔톤의 차분하고 세련된 표지가 인상적이다. 인생에 대한 환상을 벗어버리고 담담한 시선으로 인간의 고독과 사랑의 본질을 그린 저자의 작품들은, 도덕에 얽매이지 않는 자유로운 감성과 섬세한 심리묘사가 특징이다.
",2,국내도서-소설/시/희곡
443,9791186317686,91611666,카르멘,"12,000원",120원,프로스페르 메리메 저/한정주 역,지성공간,,1,국내도서-소설/시/희곡
444,9788932404752,61159799,사촌 퐁스,"13,500원",750원,오노레 드 발자크 저/정예영 역,을유문화사,"모든 악덕과 미덕의 목록을 재작성하고
욕망의 전형을 창조해 낸 사실주의 거장의 걸작

발자크의 방대한 전집 ‘인간극’의 마무리를 장식하는 만년의 대표 걸작 『사촌 퐁스』가 을유세계문학전집 93번째 작품으로 출간되었다. 『사촌 퐁스』는 국내 초역으로, 슈테판 츠바이크는 발자크의 가장 위대한 업적으로 이 작품을 평가했다. 소우주같이 방대한 규모를 자랑하는 인간극 시리즈의 마지막을 대표하는 만큼, 이 책에는 그동안 발자크가 보여 주었던 굵직한 주제 의식, 사회적인 섭리와 이치 등이 탁월하게 묘사되어 있다.",1,국내도서-소설/시/희곡
445,9788932911786,5324943,목로주점 (하),"12,420원",690원,에밀 졸라 저/유기환 역,열린책들,"궁핍의 시대를 살아가는 노동자들의 고단하고 가파른 일상
그 속에서 건져 올린 프랑스 민중 소설의 효시

미화되지 않은, 날것 그대로의 민중 언어로 쓰인 최초의 민중 소설 에밀 졸라의 『목로주점』이 열린책들 세계문학으로 출간되었다. 『목로주점』은 에밀 졸라가 소설 속에서 사회 전체를 재현하고 그 메커니즘을 파악하려는 기획으로 집필한 스무 편의 연작 소설 『루공-마카르』 총서 가운데 일곱 번째 작품이다.",2,국내도서-소설/시/희곡
446,9788949706726,4277232,파르마 수도원,"8,820원",원,스탕달 저/이혜윤 역,동서문화사,"정의를 추구하고 사랑을 꿈꾸는
'행복한 소수'를 위한 낭만의 대서사시

발자크, 플로베르와 더불어 19세기 프랑스 문학에서 가장 중요한 작가로 평가받고 있는 스탕달의 만년의 걸작. 『적과 흑』의 쥘리앵 소렐처럼 야심 많고 대담하고 도덕감이 결여된 주인공 파브리스 델 동고가 이탈리아를 배경으로 정열과 욕망을 펼치는 이야기로, 자유를 꿈꾸는 청년이 단조롭고 용렬하며 타산적인 19세기 사회(파르마 공국)에서 어떻게 살아나가는지를 보여줌으로써, 불멸의 청춘상을 그려내고 있다.",2,국내도서-소설/시/희곡
447,9788937480041,310495,삼총사 1,"10,800원",600원,알렉상드르 뒤마 저/이규현 역,민음사,"2002년 알렉상드르 뒤마 탄생 이백 주년을 기념해 출간된 한국 최초의 완역본으로, 첫 시도에 걸맞은 철저한 고증 작업을 거쳐 이백여 년 전 네 총사가 펼치는 모험담을 정확하고도 생생하게 그려 냈다. 영화 「삼총사 3D」개봉에 맞춰 새로운 표지를 선보이며 특별판으로 재출간됐다. 1844년 발표된 이후 영화, 만화, 뮤지컬 등으로 끊임없이 재탄생하며 변함없는 사랑을 받고 있는 『삼총사』는 알렉상드르 뒤마의 대표작으로 대중성과 문학성을 모두 갖춘 이 시대의 대표 고전이다.",1,국내도서-소설/시/희곡
448,9791160809220,115166435,너희들 무덤에 침을 뱉으마,"11,700원",650원,보리스 비앙 저/이재형 역,휴머니스트,"어긋난 복수심이 맞닥뜨린 낭떠러지……
거침없이 질주하는 20세기 프랑스 누아르 소설의 고전

알베르 카뮈, 앙드레 말로, 장 폴 사르트르 등 엘리트 작가들의 책을 제치고 50만 부 이상 판매되며 베스트셀러가 된 소설. 파리의 한 호텔 방에서 벌어진 실제 살인 사건의 현장에서 밑줄이 그어진 채 발견되어 큰 논란을 일으킨 작품이기도 하다. 신랄하고 자극적인 서사와 어긋난 복수심이 빚어낸 파국 때문에 출간 당시에도 독자와 평자에게 커다란 충격을 안겼다. 출간 후 3년 만에 판금 조치 되며 10만 프랑의 벌금을 선고받기도 했지만, 지금까지도 수많은 나라에서 번역되며 인종이나 계급의 차별 문제를 예리하게 다룬 20세기 프랑스 누아르 소설의 고전으로 손꼽힌다.",1,국내도서-소설/시/희곡
449,9791159039508,61276666,웃는 남자 1~3권 합본,"17,820원",990원,빅토르 위고 저/백연주 역,더클래식,"출간 당시 유럽을 충격에 빠뜨린 문제작! 
프랑스 대문호 빅토르 위고의 가장 완성도 높은 숨은 명작, 『웃는 남자』

몇 년 전, 『웃는 남자』 원작의 탄탄한 서사를 뛰어난 영상미를 가미해 볼거리를 제공한 영화 〈웃는 남자〉가 개봉되어 원작 못지않은 극찬을 받았다. 원작을 읽으며 상상만 할 수 있는 광대들의 공연장, 빈민가 시장, 무도회장, 웅장한 고성 등을 화려하면서도 그로테스크하게 묘사한 덕분이었다. 무엇보다 입이 찢어져 평생 웃는 남자로 살아야 하는 그윈플렌이라는 인물이 두려우면서도 가련하게 그려져 강렬한 이미지를 남겼다. 『레미제라블』 『노트르담의 꼽추』 등 뛰어난 걸작을 남긴 프랑스 대문호 빅토르 위고의 숨은 명작, 『웃는 남자』는 1869년에 발표됐다. 빅토르 위고가 스스로 “이 이상의 위대한 작품을 쓰지 못했다”고 평가했을 정도로 완성도가 높다.",1,국내도서-소설/시/희곡
450,9788949706474,3633957,적과 흑,"13,500원",원,스탕달 저/서정철 역,동서문화사,"뚜렷한 계급 의식을 그린 프랑스 소설사 상의 걸작으로 평가되고 있는 작품. 뛰어난 재능과 위선을 무기로 출세를 위해 세상과 맞서지만 끊임없는 감성과 양심 앞에서 번민하는 한 청년의 성공과 좌절을 그리고 있다. 프랑스 왕정복고 시대의 암흑기를 묘사한 작품으로 사실적인 서술묘사와 비연속적인 수법으로 사실주의와 심리주의 소설의 걸작을 평가받고 있다. 이 소설의 제목인 적(赤)은 제정시대의 영광을, 흑(黑)은 왕정복고시대 암울을 상징하여 프랑스 혁명 이후 당시의 시대상을 잘 보여주고 있다.",1,국내도서-소설/시/희곡
451,9791170400981,110328817,쥘 베른 베스트 컬렉션 세트,"138,600원","7,700원",쥘 베른 저/김석희 역,열림원,"SF 개척자 쥘 베른의 명작 컬렉션을
한국 최고의 번역가 김석희의 완역본으로 만난다!

“쥘 베른은 미지의 세계를 향한 탐험의 길을 열어준 선구자다.” _베르나르 베르베르

2022년 6월 21일, 우주로 가는 길을 연 누리호 발사 성공에 대한민국의 전 국민이 주목했다. 그런데 지금으로부터 약 150년 전, 최초로 과학을 응용해 인간이 우주를 탐험하는 소설을 쓴 작가가 있다. 시대를 앞선 과학적 창의력과 문학적 상상력을 절묘하게 결합한 주인공은 바로, 소설가 쥘 베른. 『80일간의 세계일주』 『15소년 표류기』의 저자로 우리에게 익숙한 쥘 베른의 베스트 컬렉션이 열림원에서 출간됐다. ‘쥘 베른 베스트 컬렉션’은 그의 여러 소설 가운데 한국의 독자들이 가장 사랑한 11권을 가려 뽑았다. 널리 알려진 작품도 있지만, 국내 최초로 유일하게 열림원이 소개한 작품도 있다.",1,국내도서-소설/시/희곡
452,9788932321912,106539317,밤이 오기 전에,"14,400원",800원,마르셀 프루스트 저/유예진 역,현암사,"『잃어버린 시간을 찾아서』 단 하나의 작품으로 
20세기 최고 작가의 반열에 오른 마르셀 프루스트, 
그가 20대 시절 가장 내밀한 곳에서 실험한 단편들

20세기 최고의 작가 중 하나로 꼽히며 ‘소설가들의 소설가’로 칭송받는 작가. 『잃어버린 시간을 찾아서』 단 하나의 작품으로 단숨에 세계 문학사의 정점에 올라선 마르셀 프루스트(1871-1922). 그의 100주기를 맞아 프루스트가 청년 시절 써 내려간 미공개 단편이 담긴 소설집 『밤이 오기 전에』가 연세대 유예진 교수의 번역으로 국내 최초 출간됐다.

이 책에 실린 작품들은 모두 프루스트가 20대 초중반에 쓴 것으로, 대작가의 젊은 시절 혈기 넘치면서도 도전적인 면모를 엿볼 수 있다. 책은 2부로 나뉘어 있다. 1부에 실린 6편은 프루스트 생전에 발표된 작품이며, 2부에 실린 12편은 프루스트의 사후에 발굴된 원고들이다.",1,국내도서-소설/시/희곡
453,9791164453498,94512438,마담 보바리,"9,900원",550원,귀스타브 플로베르 저/김중현 역,더클래식,"출간 당시 많은 논란에 휩싸이며 인기를 얻었던 작품 
프랑스 사실주의 문학의 대표적인 작가 플로베르의 걸작

이 작품은 실제로 당시 화젯거리였던 ‘들라마르 부인 사건’을 소재로 한 작품으로 프랑스 사실문학의 대표 작가인 귀스타브 플로베르의 걸작이다. 출간 당시 공중도덕 및 종교적 미풍양속을 해쳤다는 이유로 작가 플로베르가 법원에 피소되기도 했다. 변호사 쥘 세나르의 논리적인 변론으로 무죄 판결을 받고 마침내 세상에 나오게 된 이 작품은 출간 당시 폭발적인 인기를 얻으며 독자들로부터 호평을 받았다. 

플로베르는 자연의 감정과 공간을 중시하는 낭만주의적 글쓰기를 지향하며 사물을 있는 그대로 정확히 표현하는 사실주의 문학을 위해 평생 애썼다. 돌멩이 하나를 묘사하는 데도 가장 알맞은 단 하나의 단어를 생각했다는 일화는 그의 글쓰기가 얼마나 치열했는지 가늠하게 해 준다. 플로베르는 문체를 아주 중요하게 생각했으며, 마지막까지 강조하였다.",1,국내도서-소설/시/희곡
454,9791137200630,89833092,알퐁스 도데 단편소설 : 별 · 아를의 여인 · 마지막수업,"10,400원",원,알퐁스 도데 저,BOOKK(부크크),,6,국내도서-소설/시/희곡
455,9791189217433,141798637,펠리시타 호가 곧 출발합니다,"15,300원",850원,비르지니 그리말디 저/지연리 역,저녁달,"★에크리르 오페미닌 문학상 수상!
★아마존 프랑스 소설 베스트셀러!
★정여울 작가 강력 추천!

“너무나 사랑스러운 책” - 정여울(작가, 『데미안 프로젝트』 저자)

1만 개가 넘는 독자 리뷰!
프랑스가 뜨겁게 사랑하는 소설가, 비르지니 그리말디의 놀라운 데뷔작!

“모두가 사랑에 빠질 작가를 드디어 발견했다!”
400만 독자를 사로잡는 환상적인 스토리텔러의 등장!

문학을 품은 나라, 프랑스에서 한 신인 소설가가 돌풍을 일으키며 등장한다. 블로그를 운영하며 재치있는 글로 독자와 소통했던 그녀는 2014 에크리르 오페미닌 문학상을 수여하고 다음해 첫 소설을 출간한다. 그녀의 데뷔 소설은 출간하자마자 단숨에 아마존 프랑스 소설 분야 베스트셀러오 올랐고 독자들 사이에서 빠르게 입소문을 타기 시작했다. 그리고 같은 해 소설 선호도 1위에 오르며 강렬한 인상을 남겼다.",2,국내도서-소설/시/희곡
456,9791164456420,119119732,초판본 어린 왕자 (금장 에디션),"13,500원",750원,앙투안 생텍쥐페리 저/김미정 역,더스토리,"세상에서 가장 순수한 영혼, 『어린 왕자』 오리지널 초판본 표지디자인!

생텍쥐페리는 프랑스의 유명한 소설가로, 그의 작품 『어린 왕자』는 전 세계적으로 『성경』, 『자본론』 다음으로 많이 읽히는 책이다. 250여 개 언어로 번역되었고 1억 부 이상이 팔렸다. 그런데 아이러니하게도 『어린 왕자』는 프랑스가 아니라 미국 뉴욕에서 처음 출판되었다. 당시 생텍쥐페리는 제2차 세계대전으로 미국에서 망명 중이었고, 『어린 왕자』는 1943년 4월 6일에 영어판과 프랑스어판으로 뉴욕에서 동시 출간되었다.

더스토리에서 출간한 무선 초판본 표지디자인 『어린 왕자』는 1943년 뉴욕에서 출판된 프랑스어판 초판본 표지디자인을 그대로 되살렸다. 어둡지도 너무 빛바래지도 않은 노란색 표지와 어린 왕자의 연둣빛 옷의 색감이 잘 살아 있으며, 본문에는 생텍쥐페리의 친필 사인이 들어 있다. 또한 작가가 직접 그린 일러스트들이 시적이고 아름다운 어린 왕자의 이야기를 더욱 풍성하게 만들어준다.",1,국내도서-소설/시/희곡
457,9791186686126,33275592,프랑스 유언,"14,400원",800원,안드레이 마킨 저/이재형 역,무소의뿔,"프랑스 최고 문학상 3개 동시 수상작! 
공쿠르상, 메디치상, 고등학생들이 선정하는 공쿠르상 수상

안드레이 마킨은 모스크바에서 공부를 마치고 노브고로드에서 철학을 가르쳤다. 1987년 프랑스를 여행하던 중 정치적 망명을 한다. 그러나 그의 생활 조건과 주거 조건은 매우 열악해서 파리의 빈민가라고 할 수 있는 벨빌과 메닐몽탕 사이에 작은 방 하나를 얻어 살았으며, 한때는 페르라세즈 공동묘지에 있는 지하묘소에서 지내기까지 했다. 글을 쓰는 것도 쉽지 않아 프랑스어로 쓴 그의 원고는 번번이 퇴짜를 맞았다. 출판사 입장에서는 러시아 출신 작가가 세 살 때부터 프랑스 출신 할머니에게 배운 제 2 외국어인 프랑스어로 직접 작품을 쓴다는 사실을 쉽게 받아들이기가 힘들었다. 다행히 그의 섬세한 서정을 높이 산 한 편집자의 도움으로 문장을 다듬어 펴낸 것이 1995년 『프랑스의 유언』.",2,국내도서-소설/시/희곡
458,9791191859959,126987743,사랑,"13,500원",750원,마르그리트 뒤라스 저/장승리 역,난다,"“이제야 그가 그녀를 바라본다.
아름다움은 여기에, 여전히 존재한다.”
사랑에 대한 한 편의 아름다운 장시,
뒤라스 문학의 결정적 전환점

다양한 작품으로 초기부터 대중적인 성공을 거뒀던 뒤라스의 글쓰기는 1960년대 후반에 들어서 더욱 심화되기 시작한다. 뒤라스의 글은 전통적인 소설의 논리에서 벗어나 충동과 공허로 이루어진 미지의 영역으로 한층 깊숙이 빠져든다. 변화에 당황한 독자들의 반응, 비평가들의 몰이해에도 불구하고 뒤라스는 자신의 글쓰기가 결정적인 전환점을 지났다는 것을 인식했다.

장승리 시인의 번역으로 출간된 『사랑』은 이 변화의 중심에 있는 소설로 뒤라스가 본격적으로 영화 작업에 매진하기 직전에 쓰였다. 소설적 글쓰기의 가장자리에서 탄생한 듯한 이 작품은 바다를 배회하는 익명의 인물들을 아득한 시선으로 담아낸다.",2,국내도서-소설/시/희곡
459,9788947548601,115309749,푸른 행성이 있었다,"14,400원",800원,프랑수아 를로르 저/양영란 역,마시멜로,"전 세계 30여 개국 500만 독자를 행복으로 안내한
『꾸뻬 씨』의 저자 프랑수아 를로로의 첫 SF소설! 
* 한국어판 서문 특별수록
‘결국 나를 구한 건 사랑이었다!’
먼 미래 화성에서 지구로 파견된 남자의 지구 모험기 

우리 인생의 영원한 숙제인 행복과 사랑, 우정에 관한 여행을 떠났던 『꾸뻬 씨』 시리즈의 저자 프랑수아 를로르가 다시 한번 우리는 깜짝 놀라게 할 흥미로운 이야기로 돌아왔다. 이전 시리즈는 30여 개국에 번역 출간될 정도로 사랑을 받았는데, 이번 소설 『푸른 행성이 있었다』 또한 ‘독자를 행복하게 할 감동적이고 놀라운 이야기’라는 평을 받으며 화제가 되었다. 저자의 첫 SF장르인 이번 책은 마치 한 편의 영화를 보는 것 같은 흥미로운 전개와 놀라운 반전으로 독자들의 눈길을 사로잡는다. 

몇 차례의 커다란 전쟁과 폭동으로 인류가 피폐해진 지구를 떠나 화성 콜로니에 정착한 지 한 세기.",1,국내도서-소설/시/희곡
