순위,ISBN,상품번호,상품명,판매가,YES포인트,저자,출판사,설명,출고예상일,관리분류
1,9791141609962,145361149,연매장,"15,750원",870원,팡팡 저/문현선 역,문학동네,"*2017 루야오문학상 수상* 
*수상 즉시 금서로 지정된 문제작*

성역 없는 글쓰기로 정부에 의해 삭제된 작가
BBC 선정 2020 올해의 여성 100인 ‘팡팡’의 대표작 
모든 의혹과 고통을 기꺼이 써내는 작가 ‘팡팡’이
진실에 닿기 위해 분투한 문학적 기록

2020년 신종 코로나바이러스로 봉쇄된 우한의 참상과 생존기를 담은 『우한일기』 출간 이래 중국 정부에서 금서 작가로 지명당한 팡팡은 평생 진실한 글쓰기를 소명으로 삼은 작가다. 거대한 흐름 속에서 고군분투하는 개인의 눈을 통해 역사를 보여주고, 이데올로기에 파묻힌 인간의 존엄을 섬세하고 생동감 있게 그려왔다. 『깨진 칠현금』으로 2010년 제5회 루쉰문학상, 『연매장』으로 2017년 제3회 루야오문학상을 수상하며 뛰어난 문학성을 인정받았으며, 모두가 이야기하기 꺼리는 주제를 기꺼이 써내며 성역 없는 글쓰기를 이어나가고 있다.",1,국내도서-소설/시/희곡
2,9788954442688,90926731,삼체 1~3 세트,"60,300원","3,350원","류츠신 저/이현아,허유영 공역",자음과모음,"아시아 최초로 휴고상을 수상하며 SF 거장으로 등극한 류츠신의 대표작 『삼체』. 『1부―삼체문제』 『2부―암흑의 숲』 『3부―사신의 영생』으로 이어지는 ‘지구의 과거’ 3부작은 무수한 위험이 숨어 있는 ‘암흑의 숲’과 같은 우주에서 인류가 마주하게 될 운명을 대담한 상상력으로 그려냈다. 오바마 미국 전 대통령이 “『삼체』를 읽을 때 작품 스케일이 워낙 커서 백악관의 일상사가 사소하게 느껴졌다”(『뉴욕타임스』 인터뷰)라고 평했을 만큼, 『삼체』가 구축하고 있는 세계는 무한한 우주를 향해 끝없이 팽창한다.",1,국내도서-소설/시/희곡
3,9791156754312,122280138,인생,"15,120원",840원,위화 저/백원담 역,푸른숲,"전 세계인의 마음을 울린 위대한 작가 위화
등단 40주년 기념 『인생』 『허삼관 매혈기』 개정판 출간!

현대 고전의 반열에 오른
‘삶’이 계속되는 한 영원히 유효한 이야기

전 세계적으로 중국 현대문학을 대표하는 작가 위화의 등단 40주년을 맞아 대표작 『인생』, 『허삼관 매혈기』 개정판이 도서출판 푸른숲에서 출간되었다. 2007년 3판 출간 이후 무려 16년 만의 개정이다. 1996년 국내 첫 출간 이후 지난 30여 년간 여러 세대를 통과하면서도 줄곧 큰 사랑을 받아온 두 작품을 새 모습으로 만나볼 수 있게 되었다. 내부적으로는 번역가 최용만과 백원담이 완성도에 심혈을 기울여 문장을 다시 세밀히 손보았으며, 외부적으로는 전통적 디자인에서 탈피해 모던한 디자인으로서 고전의 면모를 강조하였다.

위화는 노벨문학상을 수상한 모옌, 루쉰문학상을 수상한 옌렌커와 함께 중국 현대문학을 대표하는 거장이다.",1,국내도서-소설/시/희곡
4,9788954442695,107477481,삼체 1부,"15,300원",850원,류츠신 저/이현아 역,자음과모음,"세 개 태양이 불타는 켄타우루스 알파성 삼중성계
삼체 문명의 항성급 함대가 지구를 향해 출발한다
“인류가 이 전쟁에서 승리하는 것은 불가능하다. 너희는 벌레다!”
SF의 신화가 된 류츠신 『삼체』

아시아 최초로 휴고상을 수상하며 SF 거장으로 등극한 류츠신의 대표작 『삼체』. 『1부 : 삼체문제』 『2부 : 암흑의 숲』 『3부 : 사신의 영생』으로 이어지는 ‘지구의 과거’ 3부작은 무수한 위험이 숨어 있는 ‘암흑의 숲’과 같은 우주에서 인류가 마주하게 될 운명을 대담한 상상력으로 그려냈다. 오바마 미국 전 대통령이 “『삼체』를 읽을 때 작품 스케일이 워낙 커서 백악관의 일상사가 사소하게 느껴졌다”(『뉴욕타임스』 인터뷰)라고 평했을 만큼, 『삼체』가 구축하고 있는 세계는 무한한 우주를 향해 끝없이 팽창한다.

『삼체』는 작가가 컴퓨터 엔지니어로 일하며 축적한 과학적 이론을 기반으로 독자들에게 우주에 관한 초월적인 시야를 선사한다.",1,국내도서-소설/시/희곡
5,9791160078572,116768623,13.67,"17,100원",950원,찬호께이 저/강초아 역,한스미디어,"중국어권 최고의 추리소설 작가
찬호께이의 대표작 『13·67』
10쇄 기념 전면 개정판 출간!

2015년 추리소설의 불모지로 여겨졌던 중국, 그것도 홍콩에서 날아와 한국 독자들을 놀라게 한 걸작 추리소설이자 찬호께이의 대표작. 찬호께이는 홍콩 작가로서 『기억하지 않음, 형사』(한스미디어 출간)로 ‘제2회 시마다 소지 상’을 수상한 데 이어, 2014년에는 ‘2015 타이베이 국제 도서전’에서 대상을 수상한 『13·67』을 내놓아 결정적으로 국적을 넘어 세계에 이름을 떨치는 작가로 자리잡았다.
『13·67』은 홍콩을 배경으로 1967년도부터 2013년까지의 여섯 개 사건을 역순으로 펼쳐놓는 장편소설이다. 2020년대에 읽어도 참신한 순서의 구성에 더해 혼수상태에서조차 명추리를 자랑하는 경찰 고문 관전둬가 독자의 마음을 강렬하게 사로잡는다. ",1,국내도서-소설/시/희곡
6,9791158884680,67230426,종이 동물원,"15,300원",850원,켄 리우 저/장성주 역,황금가지,"가장 주목받는 SF 환상문학 작가 켄 리우의 소설집. 최고의 권위를 자랑하는 휴고 상, 네뷸러 상, 세계환상문학상을 40년만에 첫 동시 수상한 대표작 「종이 동물원」을 비롯하여 SF에서부터 하드보일드, 대체 역사, 전기(傳奇)소설에 이르기까지 그의 걸작 단편 14편을 수록했다.",1,국내도서-소설/시/희곡
7,9788954442701,107477517,삼체 2부,"22,500원","1,250원",류츠신 저/허유영 역,자음과모음,"세 개 태양이 불타는 켄타우루스 알파성 삼중성계
삼체 문명의 항성급 함대가 지구를 향해 출발한다
“인류가 이 전쟁에서 승리하는 것은 불가능하다. 너희는 벌레다!”
SF의 신화가 된 류츠신 『삼체』

아시아 최초로 휴고상을 수상하며 SF 거장으로 등극한 류츠신의 대표작 『삼체』. 『1부 : 삼체문제』 『2부 : 암흑의 숲』 『3부 : 사신의 영생』으로 이어지는 ‘지구의 과거’ 3부작은 무수한 위험이 숨어 있는 ‘암흑의 숲’과 같은 우주에서 인류가 마주하게 될 운명을 대담한 상상력으로 그려냈다. 오바마 미국 전 대통령이 “『삼체』를 읽을 때 작품 스케일이 워낙 커서 백악관의 일상사가 사소하게 느껴졌다”(『뉴욕타임스』 인터뷰)라고 평했을 만큼, 『삼체』가 구축하고 있는 세계는 무한한 우주를 향해 끝없이 팽창한다.

『삼체』는 작가가 컴퓨터 엔지니어로 일하며 축적한 과학적 이론을 기반으로 독자들에게 우주에 관한 초월적인 시야를 선사한다. 『삼체』는 문화대혁명에서부터 수백 년 후 외계 문명과 인류의 전면전까지로 이어지는 SF 대서사시로 『1부 : 삼체문제』에서는 지구로부터 4광년 떨어져 있는 삼체 세계와 신호를 주고받으면서 외계 문명과 조우하게 된 인류의 운명을 그려내고 있으며, 『2부 : 암흑의 숲』에서는 “문명은 끊임없이 성장하고 확장되지만 우주의 물질 총량은 불변한다”라는 우주 공리(公理)를 내세우며 ‘암흑의 숲’과 같은 우주에서 살아남기 위해서는 외계 문명과의 생존경쟁이 불가피함을 말한다. 『3부 : 사신의 영생』에서는 외계 문명과의 전면전에서 살아남은 인류가 우주에 존재하는 더 큰 공포와 맞닥뜨리며 대단원의 막을 내린다. 1부에서 3부로 이어지는 무한한 상상력은 우주에 대한 본질적인 사고를 극한으로 끌어올리며 지적 즐거움을 경험하게 한다.
",1,국내도서-소설/시/희곡
8,9788925569154,89597280,이문열 삼국지 세트,"151,200원","8,400원",나관중 저/이문열 평역/정문 그림,알에이치코리아(RHK),"누적판매 2,000만 부
우리 시대를 대표하는 『이문열 삼국지』가 
현대적인 감각으로 다시 돌아왔다!

젊은 세대를 위해 내용을 손보고, 한자어 독음을 달아 읽기 쉬운 『삼국지』

1988년 출간된 이래 누적판매 2,000만 부라는 대기록을 세운『이문열 삼국지』가 출간 30여 년 만에 새롭게 출간된다. 나관중 판본을 기본으로 하여 우리 시대 대표 작가인 이문열의 글맛으로 살려낸 『이문열 삼국지』는 오랫동안 최고의 고전으로 사랑받아왔다. 무수한 평역본 중 특히 이 책이 한 세대를 넘어서까지 생명력을 가질 수 있었던 것은, 이문열 작가 특유의 날카로운 문장과 흡입력 있는 구성이 돋보였기 때문이다. 방대한 서사와 영웅호걸들의 이야기들을 지루하지 않게, 다음 권을 넘겨보게 만들어 삼국지를 처음 접한 이들도 충분히 재미있게 읽을 수 있었던 것.",1,국내도서-소설/시/희곡
9,9788954442718,107477564,삼체 3부,"22,500원","1,250원",류츠신 저/허유영 역,자음과모음,"세 개 태양이 불타는 켄타우루스 알파성 삼중성계
삼체 문명의 항성급 함대가 지구를 향해 출발한다
“인류가 이 전쟁에서 승리하는 것은 불가능하다. 너희는 벌레다!”
SF의 신화가 된 류츠신 『삼체』

아시아 최초로 휴고상을 수상하며 SF 거장으로 등극한 류츠신의 대표작 『삼체』. 『1부 : 삼체문제』 『2부 : 암흑의 숲』 『3부 : 사신의 영생』으로 이어지는 ‘지구의 과거’ 3부작은 무수한 위험이 숨어 있는 ‘암흑의 숲’과 같은 우주에서 인류가 마주하게 될 운명을 대담한 상상력으로 그려냈다. 오바마 미국 전 대통령이 “『삼체』를 읽을 때 작품 스케일이 워낙 커서 백악관의 일상사가 사소하게 느껴졌다”(『뉴욕타임스』 인터뷰)라고 평했을 만큼, 『삼체』가 구축하고 있는 세계는 무한한 우주를 향해 끝없이 팽창한다.

『삼체』는 작가가 컴퓨터 엔지니어로 일하며 축적한 과학적 이론을 기반으로 독자들에게 우주에 관한 초월적인 시야를 선사한다. 『삼체』는 문화대혁명에서부터 수백 년 후 외계 문명과 인류의 전면전까지로 이어지는 SF 대서사시로 『1부 : 삼체문제』에서는 지구로부터 4광년 떨어져 있는 삼체 세계와 신호를 주고받으면서 외계 문명과 조우하게 된 인류의 운명을 그려내고 있으며, 『2부 : 암흑의 숲』에서는 “문명은 끊임없이 성장하고 확장되지만 우주의 물질 총량은 불변한다”라는 우주 공리(公理)를 내세우며 ‘암흑의 숲’과 같은 우주에서 살아남기 위해서는 외계 문명과의 생존경쟁이 불가피함을 말한다. 『3부 : 사신의 영생』에서는 외계 문명과의 전면전에서 살아남은 인류가 우주에 존재하는 더 큰 공포와 맞닥뜨리며 대단원의 막을 내린다. 1부에서 3부로 이어지는 무한한 상상력은 우주에 대한 본질적인 사고를 극한으로 끌어올리며 지적 즐거움을 경험하게 한다.
",1,국내도서-소설/시/희곡
10,9791156751298,115570358,원청,"16,650원",920원,위화 저/문현선 역,푸른숲,"현지 출간과 동시 150만 부 판매
해외 20여 개국 판권 판매

8년 만에 대륙을 다시 뒤흔든 위화 열풍
“개인의 운세를 넘어 시대의 운명을 생각하게 만드는 걸작!”

대륙 최고의 거장 위화의 새 소설 『원청: 잃어버린 도시』가 도서출판 푸른숲에서 출간되었다. 『원청』은 출간과 동시에 베스트셀러에 올랐으며 출간 1년 만에 150만 부 이상 판매되는 등 절정의 인기를 재확인시켰다. 중국 일간지 [중국청년보]는 이와 같은 현상을 두고 “문학계에서는 『원청』을 읽었느냐는 말이 인사말처럼 오갔”으며 “2021년 문학계의 중대 사건이 되었다”라고 특필했다. 

청나라로 대변되는 구시대가 저물고, 중화민국이라는 새 시대가 떠오르는 대격변기를 배경으로 펼쳐지는 『원청』은 위화의 첫 전기(傳奇) 소설로서, 작품의 스케일로나 완성도로나 가히 위화 세계의 결정판이라 할 수 있다.",1,국내도서-소설/시/희곡
11,9791168342958,147561135,"다시, 몸으로","15,750원",870원,"김초엽,김청귤,천선란,저우원,청징보,왕칸위 저/김이삭 역",래빗홀,"“우리가 빼앗겼던, 죽여야 했던 몸을 돌려주고 싶어”

2025 상하이번역문학출판사 출간 확정
한국과 중국 여성 SF작가 6인의 신체성에 관한 사유와 탐색

몸이라는 소우주와 세계라는 대우주를 그려낸 한 권의 책. _김이삭(소설가, 번역가)
‘몸’의 무게와 함께, 우리가 몸을 가진 존재이기에 대면하는 자유를 이야기한다. _심완선(SF평론가)

한국과 중국의 여성 SF 소설가 여섯 명이 ‘신체성’이라는 주제에 각자의 개성을 담아낸 단편소설을 선보이는 《다시, 몸으로》가 출간되었다. 한국에서는 올여름 서울국제도서전을 앞두고 출판사 인플루엔셜의 문학 브랜드 래빗홀에서 출간되며, 중국에서는 상하이번역문학출판사(上海?文出版社)에서 올해 8월 현지의 문학주간 행사에 맞추어 출간될 예정이다.",1,국내도서-소설/시/희곡
12,9788937463648,102350758,개구리,"14,400원",800원,"모옌 저/심규호,유소영 공역",민음사,"하늘에서 내리는 비를 가둘 수 없듯, 여자가 아이를 낳는 일도 절대 막아서는 안 된다
국가를 위한 개인의 희생은 어디까지 정당화될 수 있는가
포크너, 마르케스에 비견되는 현대 문학의 거장 모옌 대표작

중국의 산아 제한 정책인 ‘계획생육’을 정면으로 다뤄 커다란 반향을 일으킨 이 작품은 화자인 커더우가 일흔이 넘은 고모를 회상하며 시작한다. 산부인과 의사인 고모 ‘완신’은 가오미 둥베이향에서 오십 년 동안 1만 명이 넘는 아이를 받은 전설적인 인물이다. 젊은 시절 고모는 혁명 열사의 딸이라는 출신 성분에 신식 의술까지 배운 전도유망한 신여성이었다. 그러나 공군 조종사였던 약혼자가 타이완으로 망명하자 앞날에 어두운 그림자가 드리운다. 설상가상으로 정부에서 계획생육을 강압적으로 실시하면서 고모는 정관 수술과 임신 중절 수술에 나서게 되고, ‘살아 있는 염라대왕’이라는 별명과 함께 사람들의 비난과 저주에 시달린다.",1,국내도서-소설/시/희곡
13,9788954614122,4689981,아Q정전,"11,700원",650원,루쉰 저/자오옌녠 그림/이욱연 역,문학동네,"중국 근대문학의 선구자 루쉰의 대표작. 
근대 중국 민중의 슬픈 자화상, 아Q의 욕망과 좌절.

청조 말기, 신해혁명 전후의 중국사회를 아Q라는 시골 날품팔이를 주인공으로 삼아 그려낸 소설. 중국을 변혁하기 위해서는 잠들어 있는 민중의 활력을 일깨우는 것이 최우선이라 생각했던 루쉰은 이 작품을 통해 지난날의 영광에 머물러 현실을 직시하지 못하는 당시 중국인들의 상황, 과거의 환상에 의지해 살아가는 자기위안적인 모습을 날카롭게 비판한다.",1,국내도서-소설/시/희곡
14,9791156754305,122280147,허삼관 매혈기,"15,120원",840원,위화 저/최용만 역,푸른숲,"전 세계인의 마음을 울린 위대한 작가 위화
등단 40주년 기념 『인생』 『허삼관 매혈기』 개정판 출간!

현대 고전의 반열에 오른
‘삶’이 계속되는 한 영원히 유효한 이야기

전 세계적으로 중국 현대문학을 대표하는 작가 위화의 등단 40주년을 맞아 대표작 『인생』, 『허삼관 매혈기』 개정판이 도서출판 푸른숲에서 출간되었다. 2007년 3판 출간 이후 무려 16년 만의 개정이다. 1996년 국내 첫 출간 이후 지난 30여 년간 여러 세대를 통과하면서도 줄곧 큰 사랑을 받아온 두 작품을 새 모습으로 만나볼 수 있게 되었다. 내부적으로는 번역가 최용만과 백원담이 완성도에 심혈을 기울여 문장을 다시 세밀히 손보았으며, 외부적으로는 전통적 디자인에서 탈피해 모던한 디자인으로서 고전의 면모를 강조하였다.

위화는 노벨문학상을 수상한 모옌, 루쉰문학상을 수상한 옌렌커와 함께 중국 현대문학을 대표하는 거장이다.",1,국내도서-소설/시/희곡
15,9791160079166,119692776,망내인,"17,550원",970원,찬호께이 저/강초아 역,한스미디어,"진실을 분별하지 못하는 시대
우리는 모두 ‘네트워크에 사로잡힌 사람들’

『13·67』로 한국 추리소설계를 뜨겁게 달궜던 찬호께이가 700쪽이 넘는 대작을 들고 돌아왔다. 『13·67』 이후 이 작품에 2년간 심혈을 기울인 찬호께이는 더욱 성숙해진 서사, 교묘하고 정밀한 구성, 독자의 마음을 파고드는 묘사로 우리 앞에 다이아몬드처럼 찬란한 걸작을 데려왔다. 그가 짜낸 촘촘한 그물망은 우리를 가두고 힘껏 발버둥 쳐도 빠져나가지 못하게 한다. 이번 작품의 제목은 『망내인』, 우리 식으로 풀자면 ‘네트워크 인간’이다. 이야기의 무대는 『13·67』과 마찬가지로 홍콩. 다만 『13·67』이 홍콩의 역사를 2013년에서 시작해 1967년까지 역순으로 밟아나갔다면 이번 『망내인』은 2015년도에 일어난 사건을 다룬다. 그리고 그 사건은 지역과 나라를 뛰어넘어 동시대성을 확보한다.",1,국내도서-소설/시/희곡
16,9788925568799,89240892,이문열 삼국지 1,"16,200원",900원,나관중 저/이문열 평역/정문 그림,알에이치코리아(RHK),"이문열 평역 삼국지 30년 만의 개정 신판 출간! 
독보적인 문장으로 읽는 우리 시대의 삼국지 

누적판매 2,000만 부
우리 시대를 대표하는 『이문열 삼국지』가 
현대적인 감각으로 다시 돌아왔다!

젊은 세대를 위해 내용을 손보고, 한자어 독음을 달아 읽기 쉬운 『삼국지』

1988년 출간된 이래 누적판매 2,000만 부라는 대기록을 세운『이문열 삼국지』가 출간 30여 년 만에 새롭게 출간된다. 나관중 판본을 기본으로 하여 우리 시대 대표 작가인 이문열의 글맛으로 살려낸 『이문열 삼국지』는 오랫동안 최고의 고전으로 사랑받아왔다. 무수한 평역본 중 특히 이 책이 한 세대를 넘어서까지 생명력을 가질 수 있었던 것은, 이문열 작가 특유의 날카로운 문장과 흡입력 있는 구성이 돋보였기 때문이다. 방대한 서사와 영웅호걸들의 이야기들을 지루하지 않게, 다음 권을 넘겨보게 만들어 삼국지를 처음 접한 이들도 충분히 재미있게 읽을 수 있었던 것. 더불어 다른 판본에서는 삭제되거나 경시된 ‘시’, ‘평’ ‘표’ 등 중국 문학의 특징을 고스란히 살려낸 서사와 문학적 힘이 발휘된 덕분이기도 하다. 

이번 개정 신판에서는 이런 장점은 유지하면서, 지난 30년간 독자들에게서 받은 질문과 평역자 자신이 계속하여 고민하였던 내용들을 새롭게 손보고, 요즘 세대도 쉽게 읽을 수 있도록 한자어의 독음과 주석을 달았으며, 의미가 명확한 한자어는 병기하지 않음으로써 좀 더 읽기 쉽도록 고쳤다. 작가는 수개월에 걸쳐 한 글자 한 글자를 곱씹으며 문장을 다시 만졌다. 여기에 타이완의 유명 화가인 정문(鄭文) 작가의 그림을 함께 수록하여 보는 즐거움을 배가했다. 독특한 화풍으로 삼국지의 각 인물과 주요 사건을 그려낸 정문의 그림은 삼국지 특유의 서사를 더욱 돋보이도록 만들어준다. ",1,국내도서-소설/시/희곡
17,9791190147774,105746654,고정욱 삼국지 세트,"128,700원","7,150원",고정욱 평역,애플북스,"꿈을 잃은 청소년의 가슴을 두드려라! 
한 번뿐인 인생, 하나뿐인 영웅 서사 
주석으로 쉽게 읽는 최초의 삼국지!
고정욱 작가의 친절한 주석과 고증을 통한 일러스트로 더 완벽해진 삼국지

그동안 어린이와 청소년 독자들의 마음을 사로잡으며 인기작가 반열에 오른 고정욱 작가가 장장 5년에 걸쳐 심혈을 기울여 작업한 『고정욱 삼국지』(전 10권)를 펴냈다. 두말할 나위 없이 『삼국지』는 중국 오천 년 역사에서 가장 유명한 작품일 뿐 아니라 손에 꼽는 고전으로 자리 잡고 있다. 조조의 위, 유비의 촉, 손권의 오가 대륙을 삼등분 해 서로 치열하게 싸우고 때로 손잡으며 천하를 도모하던 시절은 말 그대로 인생의 한 축도이자, 영웅들이 쏟아져 나와 대륙을 종횡무진 누비며 우리 가슴을 뛰게 만든 영웅 서사다. 

『삼국지』의 원천은 정사인 진수의 『삼국지 三國志』다. 후한 말기부터 서진이 중국 대륙을 통일할 때까지 100여 년 동안의 격동기를 기술한 역사서다.",1,국내도서-소설/시/희곡
18,9788936479466,123239865,아Q정전,"11,700원",650원,루쉰 저/전형준 옮김,창비,"『교수신문』이 선정한 최고의 번역본
루쉰의 색다른 역작 「상서」를 추가 수록한 개정증보판 출간!

중국 현대소설의 선구자, 시대의 사상가로 평가받는 루쉰의 주요작들을 가려 뽑은 루쉰 소설선 『아Q정전』이 개정증보판으로 독자들을 만난다. 이 책은 1996년 초판 출간 이래 루쉰 문학에 접근하기 위한 가장 빼어난 필독서로 꼽히며, 청소년부터 성인까지 여러 독자층에 두루 사랑받아 왔다. 이번 개정증보판은 루쉰의 색다른 역작 「상서傷逝」를 추가 수록했을 뿐 아니라 표지와 장정을 새로운 시대에 맞추어 재단장함으로써 신선한 감각을 느끼게 한다. 무엇보다 루쉰 전문가들이 가장 신뢰하는 번역으로 선정한 바 있는 전형준 역자의 간결하고 깊이 있는 문장이 소설의 의미와 뉘앙스를 충실히 드러낸다. 로맹 롤랑, 오에 겐자부로, 위화 등 세계적인 작가들의 찬사를 받은 루쉰 문학의 정수를 깔끔하고 유려한 우리말로 만나 보자.",1,국내도서-소설/시/희곡
19,9788937464539,140476242,"색, 계","13,500원",750원,장아이링 저/문현선 역,민음사,"루쉰 이후 중국 현대 문학을 대표하는 작가, 장아이링 
베니스 국제 영화제 황금사자상 수상한 리안 감독 영화 「색, 계」 원작 소설 포함 
다섯 편의 걸작 단편 수록

“나는 남자 여자 사이의 작은 것들에 대해서만 글을 씁니다. (…) 나는 사람들이 연애할 때 
전쟁이나 혁명을 할 때보다 더 단순하고 대담해진다고 생각합니다.” ─ 장아이링

중국 현대문학을 대표하는 작가 장아이링의 단편선 『색, 계』가 민음사 세계문학전집으로 출간되었다. 리안 감독의 대표작이자 양조위, 탕웨이 배우가 열연하여 화제를 모았던 영화 「색, 계」의 원작 소설 「색, 계」(1979)가 표제작이다. 이 소설은 장아이링이 친일파 난징 정부의 관료였던 첫 번째 남편에게서 전해 들은 실화를 바탕으로 썼다.",1,국내도서-소설/시/희곡
20,9791127864552,109581606,천관사복 2,"13,500원",750원,묵향동후 저/고고 역,B-lab(디앤씨미디어),"여군산에서 ‘귀신 신랑’ 사건을 해결하고 보제관으로 돌아온 사련.
사련은 평소와 같이 운이 없는 하루를 삼랑과 함께 잘 극복하며 평화로운 일상을 보낸다.
그러나 그 평온한 시간도 잠시, 누군가가 의도적으로 보낸 전언을 받고 
함정인줄 알면서도 사건의 중심지인 ‘반월관’으로 향한다.

이번에도 함께하게 된 두 어린 신관과 우여곡절 끝에 반월관에 도착한 사련 일행.
사련은 그곳에서 예상치 못한 인물과 조우하게 된다.",1,국내도서-소설/시/희곡
