순위,ISBN,상품번호,상품명,판매가,YES포인트,저자,출판사,설명,출고예상일,관리분류
142,9788937463495,43308272,히로시마 내 사랑,"9,900원",550원,마르그리트 뒤라스 저/방미경 역,민음사,"프랑스 현대 문학의 거장 마르그리트 뒤라스가 시나리오를 집필한 영화사에 길이 남을 걸작
과거와 현재가 교차하며 영상과 문학이 한데 어우러져 이뤄 낸 독특한 미학적 성취

예술성과 장인 정신을 섬세하게 융합시킨 작품. - [뉴욕 타임스]
히로시마에서 시작된 이 러브 스토리는 진정한 의미에서 최초의 현대적 로맨스 영화이다. - [텔레그래프]

공쿠르 상 수상 작가이자 프랑스 현대 문학의 거장 마르그리트 뒤라스
알랭 레네 감독과 협업으로 완성한 아름다운 언어-영상 작품

독특한 작법과 문체로 공쿠르 상을 수상하고, 『연인』, 『모데라토 칸타빌레』 등 영화의 원작으로 대중의 인기와 프랑스 평단의 호평을 동시에 얻은 작가, 그리고 말년에 35세 연하 청년 얀과의 뜨거운 사랑으로도 화제가 되었던 마르그리트 뒤라스. 그녀가 1959년 집필한 시나리오 『히로시마 내 사랑』이 민음사 세계문학전집 349번으로 출간되었다.",1,국내도서-소설/시/희곡
143,9788932917337,22793142,오르부아르,"16,020원",890원,피에르 르메트르 저/임호경 역,열린책들,"프랑스 문학의 새로운 방향!
이 시대에 출간된 가장 아름다운 문학! 
천재적이고, 박진감 넘치며, 가슴이 벅차는 소설

피에르 르메트르의 공쿠르상 수상작 『오르부아르』(2013년, Albin michel)이 열린책들에서 출간됐다. 피에르 르메트르는 55세의 나이로 데뷔한 늦깍이 작가로, 첫 번째 소설 『이렌』이 코냑 추리 문학 페스티벌 소설상을 받으며 화려하게 등장했다. 2013년 『오르부아르』로 세계 3대 문학상이자 프랑스 최고의 문학상 공쿠르상을 수상하며 유럽 문학의 대세로 떠올랐다. 문학성과 예술성을 중심으로 수상작을 선발하는 최고 문학상에 대중 문학 작가가 뽑힌 것은 프랑스에서도 이례적인 일이었다. 공쿠르상 수상으로 대중성과 문학성을 겸비한 작가라는 것을 증명한 르메트르는 프랑스 문학의 새로운 지평이자 새로운 패러다임이라 평가받는다.",1,국내도서-소설/시/희곡
144,9788932923611,124095017,개미 (4),"14,220원",790원,베르나르 베르베르 저/이세욱 역,열린책들,"영원한 베스트셀러 『개미』를 다시 만나다

발간과 동시에 신선한 충격을 주며 기념비적 베스트셀러가 된 『개미』가 새로운 얼굴로 독자들을 다시 만난다. 개미라는 작디작은 생명체의 눈으로 바라본 흥미로운 인간의 모습과, 개미와 인간 세계를 오가는 장대한 모험을 담은 이 이야기는 여전히 여느 작품이 넘볼 수 없는 독창성과 상상력, 재미를 보장한다. 개미와 인간, 각각의 세계를 덮친 위험을 뒤쫓다가 그 길에서 서로의 존재를 발견하게 되는 1부 「개미」(1권), 개미와 인간의 직접적인 조우가 일으킨 갈등과 폭력, 그리고 종간의 화해를 모색하는 이들의 노력을 그린 2부 「개미의 날」(2, 3권), 개미들에게 감화받아 개미 혁명을 시작하려는 사람들의 이야기인 3부 「개미 혁명」(4, 5권)까지, 베르베르는 정교한 미스터리와 거대한 스케일, 천재적인 상상력으로 독자들을 이 방대하고 생생한 활극의 대단원까지 거침없이 이끌어 나간다.",1,국내도서-소설/시/희곡
145,9788932923604,123299040,개미 (3),"14,220원",790원,베르나르 베르베르 저/이세욱 역,열린책들,"영원한 베스트셀러 『개미』를 다시 만나다

발간과 동시에 신선한 충격을 주며 기념비적 베스트셀러가 된 『개미』가 새로운 얼굴로 독자들을 다시 만난다. 개미라는 작디작은 생명체의 눈으로 바라본 흥미로운 인간의 모습과, 개미와 인간 세계를 오가는 장대한 모험을 담은 이 이야기는 여전히 여느 작품이 넘볼 수 없는 독창성과 상상력, 재미를 보장한다. 개미와 인간, 각각의 세계를 덮친 위험을 뒤쫓다가 그 길에서 서로의 존재를 발견하게 되는 1부 「개미」(1권), 개미와 인간의 직접적인 조우가 일으킨 갈등과 폭력, 그리고 종간의 화해를 모색하는 이들의 노력을 그린 2부 「개미의 날」(2, 3권), 개미들에게 감화받아 개미 혁명을 시작하려는 사람들의 이야기인 3부 「개미 혁명」(4, 5권)까지, 베르베르는 정교한 미스터리와 거대한 스케일, 천재적인 상상력으로 독자들을 이 방대하고 생생한 활극의 대단원까지 거침없이 이끌어 나간다.",2,국내도서-소설/시/희곡
146,9788932923628,124095030,개미 (5),"14,220원",790원,베르나르 베르베르 저/이세욱 역,열린책들,"영원한 베스트셀러 『개미』를 다시 만나다

발간과 동시에 신선한 충격을 주며 기념비적 베스트셀러가 된 『개미』가 새로운 얼굴로 독자들을 다시 만난다. 개미라는 작디작은 생명체의 눈으로 바라본 흥미로운 인간의 모습과, 개미와 인간 세계를 오가는 장대한 모험을 담은 이 이야기는 여전히 여느 작품이 넘볼 수 없는 독창성과 상상력, 재미를 보장한다. 개미와 인간, 각각의 세계를 덮친 위험을 뒤쫓다가 그 길에서 서로의 존재를 발견하게 되는 1부 「개미」(1권), 개미와 인간의 직접적인 조우가 일으킨 갈등과 폭력, 그리고 종간의 화해를 모색하는 이들의 노력을 그린 2부 「개미의 날」(2, 3권), 개미들에게 감화받아 개미 혁명을 시작하려는 사람들의 이야기인 3부 「개미 혁명」(4, 5권)까지, 베르베르는 정교한 미스터리와 거대한 스케일, 천재적인 상상력으로 독자들을 이 방대하고 생생한 활극의 대단원까지 거침없이 이끌어 나간다.",1,국내도서-소설/시/희곡
147,9788954681704,103318582,마담 보바리,"13,050원",720원,귀스타브 플로베르 저/김남주 역,문학동네,"귀스타브 플로베르 탄생 200주년
구상과 표현의 일치라는 완전함에 도전하며
예술적 문체로 벼려낸 삶의 초상과 인류 보편의 심리

사실주의 문학의 거장 귀스타브 플로베르 탄생 200주년을 맞아, 그의 대표작 『마담 보바리』가 [문학동네 세계문학전집] 200번으로 출간된다. 소설이라는 문학 장르가 자리잡은 이후 가장 많이 읽히고 가장 높은 평가를 받았다고 해도 과언이 아닌 소설, 단 하나의 단어도 다른 단어로 대체할 수 없다는 ‘일물일어설’을 낳은 작품, “플로베르가 없었다면 프루스트도, 조이스도 없었을 것이고 체호프도 지금의 체호프가 아니었을 것”(블라디미르 나보코프)이라는 단언에 가장 크게 기여한 소설, 출간된 지 백육십여 년이 지난 지금까지도 전 세계에서 읽히며 그 항구적인 문학적 가치를 증명하는 이 고전을 삼십 년 넘게 프랑스 문학과 영미 문학을 유려한 우리말로 소개하며 국내 독자들에게 탄탄한 신뢰를 쌓아온 번역가 김남주의 번역으로 새롭게 선보인다.",1,국내도서-소설/시/희곡
148,9791188694174,59286686,인간의 대지,"5,400원",300원,앙투안 드 생텍쥐페리 저/이정은 역,디자인이음,"그 시절 우리가 사랑한 책

이음 문고는 책이 가장 낭만적이었던 시절의 문학을, 책이 가장 아름다웠던 시절의 스타일로 재탄생시켰다. 언제 어디서나 함께할 수 있는 작고 가벼운 문고판의 책 안에, 책이 낯선 사람도 쉽고 재밌게 읽을 수 있는 문학 작품을 엄선하여 담았다. 

『어린왕자』(1943)의 저자 생텍쥐페리가 조종사로 일한 경험을 바탕으로 쓴 소설 『인간의 대지』(1939). 생텍쥐페리는 존재의 탐구와 자연에 대한 경외를 간절하고도 통찰력 있게 이끌어낸다. 2차 세계대전이 한창이던 1939년, 목숨을 건 비행을 시작하는 조종사들에게 대지는 생명이며 꿈이다. 폭풍우를 헤쳐나가고 사막에서 길을 잃고 오아시스를 찾아헤매며, 적군과 대치하는 상황. 이는 사사로운 현실의 문제들에서 벗어나 인간의 본성에 가장 가깝게 다가가는 순간이다. 생텍쥐페리는 절실하고도 생생하게 감동적으로 삶을 찬양한다.",2,국내도서-소설/시/희곡
149,9791190669320,93394175,어린 왕자 초판본 리커버 고급 벨벳 양장본,"9,000원",500원,앙투안 드 생텍쥐페리 저/김수영 역,코너스톤(도서),"‘가장 중요한 것은 눈에 보이지 않아.’
모두가 사랑하는 『어린 왕자』를 초판본 리커버 고급 벨벳 양장본으로 만나보세요.

“네가 만약 오후 네 시에 온다면, 나는 세 시부터 행복할 거야. 그리고 시간이 갈수록 더 행복해지겠지. 네 시가 되면 흥분으로 안절부절못할 거야. 그래서 행복이 얼마나 값진 것인지 알게 되겠지! 하지만 네가 아무 때나 오면, 난 언제 마음의 준비를 해야 할지 모를 거야…. 그래서 의식이 필요한 거야.”

사막에 추락한 조종사가 지구를 여행 중인 어린 왕자를 만나는 생텍쥐페리의 대표작, 『어린 왕자』는 1943년 출간 이래로 지금까지 연극, 영화, 뮤지컬, 만화, 애니메이션, 오페라, 샹송, 카세트테이프, CD 등 다양한 매체로 변용되어 많은 사랑을 받고 있다. 독자들이 읽을 때마다 늘 새로운 의미를 발견하게 해주는 『어린 왕자』는 디지털 시대에 아날로그적인 종이 책만 1억 5천만 부 이상이 팔린 것으로 유명하다.",1,국내도서-소설/시/희곡
150,9791189581763,66921116,어린 왕자 미니미니북,"3,510원",190원,앙투안 드 생텍쥐페리 저,더클래식,,1,국내도서-소설/시/희곡
151,9791190533188,114336845,빈 옷장,"13,050원",720원,아니 에르노 저/신유진 역,1984Books(일구팔사북스),"칼 같은 글쓰기
'아니 에르노'라는 문학의 시초

‘기억에 대한 주관적인 시선’은 있을 수 있겠으나, 거짓과 허구는 없는 그녀의 글쓰기. 데뷔작 『빈 옷장』은 그러한 '아니 에르노라는 문학'의 시초이다. 첫 작품부터 날 것 그대로의 문장으로 스무 살의 자신이 받은 불법 낙태 수술에서 출발하여, 환경에 적응하며 사는 어린 시절을 거쳐 사춘기 시절의 상처, 가족에게 느끼는 수치심, 자신의 뿌리를 잊기 위한 노력과 부르주아층 남자아이에게 버림받은 일까지, 자신이 속한 세상에서 분리되는 과정을 그리며 그러한 분리를 일으키는 메커니즘, 한 인간을 다른 사람으로, 자신의 환경을 적으로 만드는, 문화에 대해, 하나의 문화 형태가 개인에게 한 일, 이 단절에 대해 이야기한다.

""나는 지금 이 글을 읽고 있는 당신의 삶의 결을 짐작할 수 있다.",1,국내도서-소설/시/희곡
152,9791164456871,119119804,초판본 인간의 대지,"12,420원",690원,앙투안 생텍쥐페리 저/김미정 역,더스토리,"『어린 왕자』의 작가 생텍쥐페리가 자신의 체험을 쓴 에세이적인 소설
『남방 우편기』 『야간 비행』을 잇는 비행 이야기의 결정판 『인간의 대지』
아름답고 시적인 문체로 프랑스, 미국에서 동시 출간되자마자 베스트셀러 등극

“사랑한다는 것은 서로를 마주보는 것이 아니라, 둘이서 같은 방향을 바라보는 것이다.”

1939년 아카데미 프랑세즈 소설대상을 수상한 『인간의 대지』는 15년간 비행기 조종사로 근무했던 생텍쥐페리의 경험을 바탕으로 쓰여졌다. 특히 라테코에르 항공사에서 아프리카-남아메리카 항공로를 개척하기 위해 야간 비행에 나섰던 5년(1926~1930)의 모험을 중심으로, 이후에 러시아와 스페인 내전에 특파원으로 달려가 겪은 체험을 더해, ‘세계는 어떤 곳인가, 인간은 어떤 존재인가’를 깊이 사색하여 한 편씩 썼던 글들을 소설로 재편집해 출간했다.",1,국내도서-소설/시/희곡
153,9788932924045,125393135,신 세트,"45,360원","2,520원","베르나르 베르베르 저/이세욱,임호경 역",열린책들,"상상력의 최대치를 보여 주는 베르베르 우주의 집대성
9년의 시간이 총집결된 생애 최고의 대작!

계획부터 집필에 걸린 시간만 9년에 달하는 『신』이 새로운 판형과 표지를 갖추고 독자들을 찾아왔다. 삶과 죽음 너머, 영혼의 존재와 진화, 문명의 발전 등 베르베르가 천착해 온 모든 주제가 이 소설에서 화려하게 펼쳐진다.『타나토노트』에서는 인간으로서의 삶, 『천사들의 제국』에서는 천사로서의 삶을 산 미카엘 팽송이 이번 작품에서는 144명의 신 후보생 중 하나로 등장한다. 신이 되기 위한 치열한 경쟁이 펼쳐지는 가운데 몇몇 후보생은 의문의 공격으로 죽어 가고, 미카엘 일행은 올림포스산의 비밀을 밝히기 위한 한밤의 탐험을 계속하는데……. 새롭게 출간되는 『신』은 시대에 맞추어 책의 만듦새를 변경했다. 본문 또한 일부 가다듬고 그간의 맞춤법 변화를 반영했다.",1,국내도서-소설/시/희곡
154,9788937427220,109560825,아노말리,"16,200원",900원,에르베 르 텔리에 저/이세진 역,민음사,"팬데믹의 프랑스 독자들이 일제히 선택한 소설
프랑스 판매 110만 부 이상, 전 세계 45개국 번역 출판
2020년 공쿠르상 수상작

2021년 3월 10일, 파리에서 출발해 뉴욕으로 향하는 에어프랑스 여객기가 예고에 없던 난기류를 만나 위기를 겪은 후 무사히 착륙한다. 그리고 3달 뒤인 6월 24일, 동일한 여객기가 동일한 지점에서 난기류를 만나고, 동일한 착륙 지점을 향해 간다. 도플갱어처럼 똑같은 기장과 승무원, 승객들을 싣고서……. 이 전대미문의 사건을 인지한 미국 정부는 여객기를 뉴저지 공군 기지로 비상 착륙시키고, 극비리에 과학자들을 소집한다.",2,국내도서-소설/시/희곡
155,9788993785586,9286732,페스트,"7,110원",390원,알베르 카뮈 저/김성범 역,부북스(BooBooks),,1,국내도서-소설/시/희곡
156,9791192376042,109910236,황금의 고삐,"14,220원",790원,프랑수아즈 사강 저/김인환 역 ,페이퍼로드,"* 30년 만에 부활한 사강의 대표작 *
* 이화여자대학교 불어불문학과 명예 교수 김인환의 유려한 번역 *
* 소설가이자 번역가 신유진의 추천작 *

매혹적이고 요동치며 파괴적이고 날카롭다.
사강을 수식하는 말일까, 사강의 작품을 설명하는 말일까.

여기, 또 하나의 매혹적으로 요동치는 이야기가 있다. 사강의 스물아홉 번째 책, 『황금의 고삐』다. 그는 전작에서 그랬던 것처럼 그가 가장 잘하는 질문, 사랑에 대해 묻는다. 정확히는 사랑이라 뭉뚱그린 감정 안에 무엇이 숨어 있는지를 밝힌다.
ㅡ소설가 신유진

사람들은 그녀가 단 한 권의 책을 쓴 작가로 남을 거라 생각했다. 하지만 비범한 재능은 그 삶이 타들어가는 순간에도 질주를 멈추지 않았고, 지금까지도 사강은 프랑스 문화의 상징적인 존재로 남아 있다.",1,국내도서-소설/시/희곡
157,9791190298759,90164407,페스트 (미니북),"5,850원",320원,알베르 카뮈 저/하소연 역,자화상,,1,국내도서-소설/시/희곡
158,9791195377862,110812862,두린왕자,"9,000원",500원,앙투안 드 생텍쥐페리 저/이광진 역,일삼공일프렌즈,,1,국내도서-소설/시/희곡
159,9788984374829,126684831,브루클린의 소녀,"15,750원",870원,기욤 뮈소 저/양영란 역,밝은세상,"권력을 손에 넣을 수 있다면 무슨 짓이든 한다.

- 사랑과 감동의 마에스트로 기욤 뮈소의 명품 스릴러
- 프랑스 베스트셀러 1위! 전 세계 40여 개국 출간!

『브루클린의 소녀』는 기욤 뮈소의 열세 번째 소설이다. 2004년에 발표한 『그 후에』 이후 기욤 뮈소의 소설 모두가 프랑스 베스트셀러 1위에 오른 건 프랑스에서도 놀라워하는 기록이다. 세 번째 소설 『구해줘』는 아마존 프랑스 85주 연속 베스트셀러 1위를 기록했고, 국내 주요 서점 200주 이상 베스트셀러에 등재되었다. 매년 『르 피가로』와 〈프랑스서점연합회〉에서 조사하는 베스트셀러 작가 순위에서 8년 연속 1위를 기록했다. 2016년에는 『당신, 거기 있어줄래요?』가 한국 영화로 만들어져 커다란 화제를 불러 모았다. 2018년 작 『아가씨와 밤』이 2021년 『FR2』 방송에서 6부작 드라마로 제작되어 인기리에 방영되었고, 그 외 다수의 소설이 영화와 드라마로 제작되었다.",1,국내도서-소설/시/희곡
160,9788932403342,3022379,골짜기의 백합,"10,800원",600원,오노레 드 발자크 저/정예영 역,을유문화사,"을유문화사의 새로운 세계문학전집 중 네 번째 책인 오노레 드 발자크의 『골짜기의 백합』. 을유문화사 세계문학전집은 세계 각국의 다양한 삶의 방식과 문화적 성취가 살아 있는 작품들, 새로운 번역이 필요한 고전들과 새롭게 소개해야 할 우리 시대의 작품들을 선정했다. 우리나라 최고의 역자들이 이들 작품 속 한 문장 한 문장의 숨결을 생생히 전하기 위해 심혈을 기울였으며, 단순히 번역만 한 것이 아니라 다른 작품의 번역을 꼼꼼히 검토해 주었다.",1,국내도서-소설/시/희곡
161,9791188364220,94408075,어린 왕자 (생텍쥐페리 탄생 120주년 기념 에디션),"5,400원",300원,앙투안 드 생텍쥐페리 저/정혜승 역,유나(YUNA),"생텍쥐페리 탄생 120주년 기념 에디션
1943년 ‘어린 왕자’ 초판본 표지 디자인
세상에서 가장 아름다운 이야기 ‘어린 왕자’
전 세계 어린이와 어른들이 사랑한 시대를 초월한 베스트셀러

‘어린 왕자’는 유명한 프랑스 소설가이자 비행사인 생텍쥐페리의 작품으로 전 세계 160여 개국 200여 개 언어로 출간되어 1억 부 이상 판매된 베스트셀러이다. 자신도 모르는 새 어른이 되어 버린 모든 이들에게 어린 시절의 순수함을 다시 찾고, 진정한 삶의 가치와 의미를 알려주는 명작이다. 이 책은 생텍쥐페리 탄생 120주년을 기념하고자 1943년 출간된 ‘어린 왕자’ 초판본 디자인을 그대로 살리면서 휴대하고 읽기 편한 사이즈로 제작되어 언제 어디서든 ‘어린 왕자’의 감동을 함께 할 수 있다.",1,국내도서-소설/시/희곡
162,9788954648967,56887398,돈,"16,200원",900원,에밀 졸라 저/유기환 역,문학동네,"황금과 환락의 도시 파리를 뒤흔든
사상 초유의 금융 스캔들
욕망의 민낯을 낱낱이 까발린 에밀 졸라의 역작

증권투기를 소재로 인간의 끝없는 욕망을 다양한 각도에서 탐구한 에밀 졸라의 대작 『돈』이 문학동네 세계문학전집 155번으로 출간되었다. 『돈』은 프랑스 은행가와 증권시장을 배경으로 금융자본주의의 메커니즘을 생생하고 사실적으로 그려낸 작품으로, 돈에 대한 욕망에 휩싸인 각계각층의 인간 군상을 다채롭게 묘사하고 있다. 50세의 정력적인 은행가 사카르의 성공과 몰락을 통해 인간성 파괴와 부패의 원인이지만 희망과 선행의 밑거름이기도 한 돈의 양면적 속성을 가감 없이 보여준다.",1,국내도서-소설/시/희곡
163,9788932912431,80744778,좁은 문,"12,420원",690원,앙드레 지드 저/김화영 역,열린책들,"노벨 문학상 수상 작가이자 20세기 프랑스 문학을 대표하는 작가, 앙드레 지드의 소설 『좁은 문』이 김화영 교수의 번역으로 열린책들에서 출간되었다. 열린책들에서 출간되는 [세계문학] 시리즈의 243번째 책이다.

『좁은 문』은 지드의 대표작으로, 그의 가장 [가장 완벽한 문학적 성취]라고 평가되는 작품이다. 지상의 행복을 쫓기보다 천상의 성스러움에 가닿기를 원하는 소녀 알리사와 그녀를 흠모하는 소년 제롬의 비극적인 사랑 이야기를 다루고 있다. 사촌 지간이자 연인 관계인 두 사람의 정신적인 고투와 엇갈림의 과정을 섬세한 심리 묘사를 통해 그려 냄으로써, 순수함의 지향과 관능적 천성 사이에서 흔들리고 고뇌하는 인간 본성의 모습을 생생하게 담아낸 소설이다.",1,국내도서-소설/시/희곡
164,9788931023732,132974034,지상의 양식,"9,900원",550원,앙드레 지드 저/김붕구 역,문예출판사,"“나타나엘이여, 그대 속에 들어 있는
모든 책을 불태워버려라.”

마르탱 뒤 가르에서 카뮈와 사르트르에 이르기까지
지드 이후 거의 모든 세대의 영혼을 뒤흔든 작품

엄격한 종교적 교육으로 신경쇠약에 시달리던 청년 지드. 그는 아프리카 여행으로 모든 구속에서 벗어나 강렬한 생명력을 향유하는 것이 삶의 길이라는 깨달음을 얻는다. 지드가 이 시기에 쓴 작품이 바로 《지상의 양식》이다. 삶이 베푸는 기쁨을 최대한 만끽하겠다는 지드 문학의 특징은 이 책에서 시작되었다. 소속된 모든 것에서 탈출하라는 지드의 호소는 전후 세대에 폭발적인 반응을 불러일으켰다. 《지상의 양식》은 출간 후 10년 동안 불과 500여 부밖에 팔리지 않았으나 훗날 대중에게 재발견되어 지드의 작품 중 가장 큰 사랑을 받았다. 존재론적 ‘헐벗음’에 대한 지드의 강력한 옹호는 여전히 무언가에 속박된 상태인 청년들의 마음속에 무언가를 불러일으키며 시대를 초월해 애독되고 있다.",2,국내도서-에세이
165,9791141609801,145046827,동네 공원,"11,700원",650원,마르그리트 뒤라스 저/김정아 역,문학동네,"20세기 프랑스 현대소설사에서 빼놓을 수 없는 작가 뒤라스
독특한 대화체 소설로 주목받은 초기 대표작

1955년 갈리마르에서 출간된 『동네 공원』은 뒤라스의 초기 대표작으로 꼽힌다. 1956년 9월 직접 각색해 클로드 마르탱의 연출로 파리 샹젤리제스튜디오에서 연극으로 처음 공연되었으며, 1957년 1월에는 라디오방송극으로 전파를 타기도 했다. 1940년대 전후 해방과 정치적 사회적 재건과 냉전의 여진 속에서, 심리소설의 전통과 사르트르를 위시한 실존주의의 무게에서도 벗어나, 1950년대 중반 책이 출간되던 그 무렵, 프랑스 문학계에서는 새로운 목소리에 대한 탐구와 더불어 누보로망이 곧 태동할 예정이었다. 뒤라스는 당시 프랑스공산당 당원으로 활발히 활동하다 1949년 당과 결별하긴 했어도 끊임없이 사회운동에 적극 가담했다.",2,국내도서-소설/시/희곡
166,9788932405049,99109971,아주 편안한 죽음,"10,800원",600원,시몬 드 보부아르 저/강초롱 역,을유문화사,"“엄마를 지키는 것, 그것만이 내 유일한 목표였다.”
죽음의 순간에 이루어지는 인간 존재의 아름다운 연대

엄마가 암에 걸렸다. 엄마와의 관계가 소원했던 ‘나’는 병상을 지키며 서서히 죽어 가는 엄마를 곁에서 지켜본다. 그저 넘어져 다친 것뿐이라 알고 있는 엄마에게 나와 동생 푸페트는 차마 진실을 말하지 못하고, 그렇다고 희망의 끈을 완전히 놓지도 못한다. 나는 죽음을 향해 가는 엄마를 바라보며 그녀에게서 한 여성의 삶을 읽어 낸다. 불같은 정열과 욕망을 지녔지만 자기 자신을 끈으로 옭아매도록 교육받은 여자. 뒤틀리고 훼손당한 끝에 자기 자신에게조차 낯선 존재가 되어 버린 한 인간.

20세기 프랑스를 대표하는 행동하는 지성 보부아르의 최고작 중 하나로 꼽히는 『아주 편안한 죽음』은 작가의 자전적 소설이자 보부아르의 문학적 글쓰기의 정점에 있는 작품이다.",1,국내도서-소설/시/희곡
